"Home","Age.Group","Gender","Freq"
"A3 GOLD COBRAS U16 Boys EDP","U16","Boys",1
"A3 HAMMERS U17 Boys EDP","U17","Boys",1
"A3 SEAHAWKS U16 Girls EDP","U16","Girls",1
"A3 WEST HAM U14 Boys EDP","U14","Boys",1
"ACHILLES FC 05 U13 Boys EDP","U13","Boys",1
"ACHILLES FC 07 U11 Boys EDP","U11","Boys",1
"ALLEYCATS ACADEMY RED 2007B U11 Boys EDP","U11","Boys",1
"ALLEYCATS ACADEMY RED 2007G U11 Girls EDP","U11","Girls",1
"ALLIANCE (ARGONAUTS) PREMIER 01 U17 Boys EDP","U17","Boys",1
"AMERICAS UNITED ARSENAL U16 Boys EDP","U16","Boys",1
"AMERICAS UNITED CELTIC U13 Boys EDP","U13","Boys",1
"AMERICAS UNITED NAPOLI U17 Boys EDP","U17","Boys",1
"ARUNDEL SA JUVENTUS ELITE 03 U15 Boys EDP","U15","Boys",1
"ASA LIVERPOOL FCIAA MD (FORMER ASA JUVENTUS ELITE) 02 ACADEMY U16 Boys EDP","U16","Boys",1
"ASPHALT GREEN G2003 U15 Girls EDP","U15","Girls",1
"BALTIMORE BAYS COLTS U17 Boys EDP","U17","Boys",1
"BALTIMORE BAYS LIGHTNING U16 Girls EDP","U16","Girls",1
"BALTIMORE CELTIC ELITE U15 Boys EDP","U15","Boys",1
"BALTIMORE CELTIC SC 2001 DONATELLI U17 Boys EDP","U17","Boys",1
"BALTIMORE CELTIC SC 2002 DONATELLI U16 Boys EDP","U16","Boys",1
"BALTIMORE CELTIC SC ELITE 01 GIRLS U17 Girls EDP","U17","Girls",1
"BALTIMORE CELTIC SC LLC 2007B U11 Boys EDP","U11","Boys",1
"BALTIMORE CELTIC SC SOUTH 06 U12 Boys EDP","U12","Boys",1
"BALTIMORE UNION ELITE 05B U13 Boys EDP","U13","Boys",1
"BALTIMORE UNION SC BALTIMORE UNION ELITE 03 U15 Girls EDP","U15","Girls",1
"BALTIMORE UNION SELECT 02 U16 Girls EDP","U16","Girls",1
"BAYSHORE SC BLAZE U11 Girls EDP","U11","Girls",1
"BAYSHORE VELOCITY 00 BLACK U18 Girls EDP","U18","Girls",1
"BEACHSIDE OF CONNECTICUT SC BOYS 2005 U13 Boys EDP","U13","Boys",1
"BEEKMAN FIRE ELITE U14 Girls EDP","U14","Girls",1
"BENFICA SA EUSEBIO U14 Boys EDP","U14","Boys",1
"BETHESDA SC BLUE 06 U12 Boys EDP","U12","Boys",1
"BETHESDA SC STORM 01 U17 Girls EDP","U17","Girls",1
"BLACK ROCK FC 2005 BOYS U13 Boys EDP","U13","Boys",1
"BLACK ROCK FC 2006 BOYS U12 Boys EDP","U12","Boys",1
"BLACK ROCK FC 2006 GIRLS U12 Girls EDP","U12","Girls",1
"BLACK ROCK FC 2007 BOYS U11 Boys EDP","U11","Boys",1
"BOUND BROOK FC B.B LEGENDS U17 Boys EDP","U17","Boys",1
"BOWIE FC BULLDOGS U16 Boys EDP","U16","Boys",1
"BRAUSA UNITED FUTEBOL BLUE 00 U18 Boys EDP","U18","Boys",1
"BRAUSA UNITED FUTEBOL BLUE 02 U16 Boys EDP","U16","Boys",1
"BRAUSA UNITED FUTEBOL BUFC BLUE 01 U17 Boys EDP","U17","Boys",1
"BRIDGEWATER SA IMPACT U13 Boys EDP","U13","Boys",1
"BROOKLYN CITY F.C. 2006 U12 Girls EDP","U12","Girls",1
"BROOKLYN CITY F.C. G03 U15 Girls EDP","U15","Girls",1
"BUCKINGHAM UNITED BLUE 2002 U16 Boys EDP","U16","Boys",1
"BUCKINGHAM UNITED SC 2001 PREMIER U17 Boys EDP","U17","Boys",1
"BURLINGTON COUNTY BCSA BOYS 2006 U12 Boys EDP","U12","Boys",1
"CALVERT CSA CYCLONES 04G U14 Girls EDP","U14","Girls",1
"CALVERT CSA FLAMES 07G U11 Girls EDP","U11","Girls",1
"CALVERT CSA RIPTIDE BLACK 07B U11 Boys EDP","U11","Boys",1
"CALVERT CSA UNITED 01G U17 Girls EDP","U17","Girls",1
"CALVERT CSA WARRIORS 05G U13 Girls EDP","U13","Girls",1
"CAPITAL FC 99B RED (DIPLOMATS) U19 Boys EDP","U19","Boys",1
"CEDAR STARS ACADEMY MONMOUTH B-2006 GREEN U12 Boys EDP","U12","Boys",1
"CEDAR STARS ACADEMY MONMOUTH B-2006 WHITE U13 Boys EDP","U13","Boys",1
"CEDAR STARS ACADEMY MONMOUTH G-2004 GREEN U14 Girls EDP","U14","Girls",1
"CEDAR STARS ACADEMY MONMOUTH G-2007 WHITE U11 Girls EDP","U11","Girls",1
"CEDAR STARS ACADEMY NEWARK 2007 GREEN U11 Boys EDP","U11","Boys",1
"CEDAR STARS ACADEMY STATEN ISLAND 2005 CAHILL U13 Boys EDP","U13","Boys",1
"CENTERCOURT FC 05 WHITE U13 Girls EDP","U13","Girls",1
"CENTRAL CARROLL STRIKERS U11 Boys EDP","U11","Boys",1
"CENTRAL CARROLL STRIKERS U15 Boys EDP","U15","Boys",1
"CHERRY HILL FC PREMIER SHARKS 03 U15 Boys EDP","U15","Boys",1
"CHERRY HILL FC PREMIER VIPERS 99 U19 Boys EDP","U19","Boys",1
"CLARKSTOWN '07 ELITE SAMIMI U11 Girls EDP","U11","Girls",1
"CLUB ATLETICO BOCA JUNIORS USA NY BOCA JUNIORS 2003 U15 Boys EDP","U15","Boys",1
"CLUB VALLEY 2010 DREAM CHASERS U13 Boys EDP","U13","Boys",1
"CONNECTICUT FC CFC SOUTH ORANGE 2004 U14 Girls EDP","U14","Girls",1
"CONTINENTAL FC BARCA '07F U11 Girls EDP","U11","Girls",1
"COUNCIL ROCK UNITED FC BUCKS STORM U16 Boys EDP","U16","Boys",1
"COUNCIL ROCK UNITED FC BUCKS WARRIORS U19 Boys EDP","U19","Boys",1
"CT RUSH ELITE 04 GIRLS U14 Girls EDP","U14","Girls",1
"DANUBIA GERMAN FC DANUBIA EAGLES U14 Boys EDP","U14","Boys",1
"DAVIDSONVILLE ATHLETIC ARSENAL '03 U15 Girls EDP","U15","Girls",1
"DELAWARE FOOTBALL DEFC 01 BOYS U17 Boys EDP","U17","Boys",1
"DONEGAL YOUTH SOCCER THUNDER '01 U17 Boys EDP","U17","Boys",1
"DUSC B1999 BLUE U19 Boys EDP","U19","Boys",1
"DUSC B2000 ORANGE U19 Boys EDP","U19","Boys",1
"DUSC B2001 BLUE U17 Boys EDP","U17","Boys",1
"DUSC B2001 ORANGE U17 Boys EDP","U17","Boys",1
"DUSC B2002 BLUE U16 Boys EDP","U16","Boys",1
"DUSC B2002 ORANGE U16 Boys EDP","U16","Boys",1
"DUSC B2003 BLUE U15 Boys EDP","U15","Boys",1
"DUSC B2005 BLUE U13 Boys EDP","U13","Boys",1
"DUSC G2002 BLUE U16 Girls EDP","U16","Girls",1
"EAST BRUNSWICK SC PREDATORS U17 Boys EDP","U17","Boys",1
"EAST BRUNSWICK SC THUNDER 2002 U16 Boys EDP","U16","Boys",1
"EAST BRUNSWICK SC WARRIORS U16 Boys EDP","U16","Boys",1
"EAST HANOVER PESA DINAMO U14 Boys EDP","U14","Boys",1
"EAST MEADOW THUNDER U15 Boys EDP","U15","Boys",1
"EAST WINDSOR PAL ATLETICO U14 Boys EDP","U14","Boys",1
"EAST WINDSOR PAL DYNAMO U15 Boys EDP","U15","Boys",1
"EAST WINDSOR PAL ROCKETS U15 Boys EDP","U15","Boys",1
"EDISON UNITED SA COSMOS U13 Boys EDP","U13","Boys",1
"ELIZABETH YSC GUNNERS U19 Boys EDP","U19","Boys",1
"ELIZABETH YSC REVOLUTION U13 Girls EDP","U13","Girls",1
"ELLICOTT CITY 2005 BOYS SILVER U13 Boys EDP","U13","Boys",1
"EPIC SPORTING STARS 2003 BLUE U15 Boys EDP","U15","Boys",1
"EPIC SPORTING STARS 2006/2007 BLUE U12 Boys EDP","U12","Boys",1
"FA EURO 2003 U15 Boys EDP","U15","Boys",1
"FA EURO NEW YORK 2000 U19 Boys EDP","U19","Boys",1
"FA EURO NEW YORK 2005/2006 U13 Boys EDP","U13","Boys",1
"FAIRMOUNT UNITED PHILLY SOCCER 2001 BOYS BLUE U17 Boys EDP","U17","Boys",1
"FC BERNA LEGACY 02B BLACK U16 Boys EDP","U16","Boys",1
"FC BERNA LEGACY 02B GOLD U16 Boys EDP","U16","Boys",1
"FC BERNA LEGACY 02G GOLD U16 Girls EDP","U16","Girls",1
"FC BERNA LEGACY 03G BLACK U15 Girls EDP","U15","Girls",1
"FC BORDEAUX USA 05 U13 Girls EDP","U13","Girls",1
"FC COPA ACADEMY B07 RED U11 Boys EDP","U11","Boys",1
"FC COPA ACADEMY G04 BLACK U14 Girls EDP","U14","Girls",1
"FC COPA ACADEMY G06 BLACK U12 Girls EDP","U12","Girls",1
"FC EUROPA 03' ELITEGIRLS U15 Girls EDP","U15","Girls",1
"FC EUROPA 05G ELITE U13 Girls EDP","U13","Girls",1
"FC EUROPA 2006 ELITE U13 Girls EDP","U13","Girls",1
"FC EUROPA MILAN U15 Boys EDP","U15","Boys",1
"FC EUROPA SA UNITED U14 Boys EDP","U14","Boys",1
"FC GIRONDINS DE BORDEAUX USA FC BORDEAUX USA 03 U15 Girls EDP","U15","Girls",1
"FC MILLENNIUM TIGRES U14 Boys EDP","U14","Boys",1
"FC SOMERS ARSENAL U14 Boys EDP","U14","Boys",1
"FC SPORTIKA 2001 BOYS U17 Boys EDP","U17","Boys",1
"FC SPORTIKA ACADEMY 2002B U16 Boys EDP","U16","Boys",1
"FC SPORTIKA ACADEMY 2002G U16 Girls EDP","U16","Girls",1
"FC SPORTIKA ACADEMY 2005B U13 Boys EDP","U13","Boys",1
"FC SPORTIKA CLUB U12 Boys EDP","U12","Boys",1
"FC USA 2004 BLUE U14 Boys EDP","U14","Boys",1
"FCUSA 2007 BOYS U11 Boys EDP","U11","Boys",1
"FCUSA MARYLAND BLACK 01 U17 Boys EDP","U17","Boys",1
"FLORENCE TOWNSHIP SA FLORENCE LIGHTNING U17 Boys EDP","U17","Boys",1
"FLORENCE TOWNSHIP SA LIGHTNING PREMIER U17 Boys EDP","U17","Boys",1
"FORT WASHINGTON FC UNITED U19 Boys EDP","U19","Boys",1
"FREEDOM BLAST RED U15 Girls EDP","U15","Girls",1
"FREEDOM XPLOSIONS U12 Girls EDP","U12","Girls",1
"FREEHOLD SL FURY U13 Girls EDP","U13","Girls",1
"FREEHOLD SL SCORPIONS BLUE U13 Boys EDP","U13","Boys",1
"FSA FC BOYS NPL 05 U13 Boys EDP","U13","Boys",1
"GERMAN AMERICAN KICKERS AZZURRI U19 Boys EDP","U19","Boys",1
"GERMAN AMERICAN KICKERS THUNDER U15 Girls EDP","U15","Girls",1
"GERMAN AMERICAN KICKERS UNITED U16 Boys EDP","U16","Boys",1
"GO PREMIER SOCCER 07 BLUE U11 Boys EDP","U11","Boys",1
"GPS NJ CLEARVIEW 05B U13 Boys EDP","U13","Boys",1
"GPS NJ SOUTH 05B U13 Boys EDP","U13","Boys",1
"GPSNJ CLEARVIEW 2003 BOYS U15 Boys EDP","U15","Boys",1
"HADDONFIELD SC 03 RED DAWGS U15 Boys EDP","U15","Boys",1
"HADDONFIELD SC 05 UNITED U13 Girls EDP","U13","Girls",1
"HAMILTON VIPERS U13 Boys EDP","U13","Boys",1
"HANS SOLIZ SOCCER SCHOOL TIGRES U15 Boys EDP","U15","Boys",1
"HARLEYSVILLE FC RANGERS 03/02 U16 Girls EDP","U16","Girls",1
"HARLEYSVILLE FC READY '03 U15 Boys EDP","U15","Boys",1
"HARLEYSVILLE FC READY '05B U13 Boys EDP","U13","Boys",1
"HAVERFORD ELITE 03 U15 Girls EDP","U15","Girls",1
"HAZLET UNITED THUNDER U16 Boys EDP","U16","Boys",1
"HENLOPEN HAMMERHEADS U15 Boys EDP","U15","Boys",1
"HERNDON YOUTH SOCCER HURRICANES BLACK U15 Girls EDP","U15","Girls",1
"HILLSBOROUGH 01B RAIDERS RED U17 Boys EDP","U17","Boys",1
"HMMS EAGLE FC '03 LEGENDS U15 Girls EDP","U15","Girls",1
"HMMS EAGLE FC UNION U14 Girls EDP","U14","Girls",1
"HMMS EAGLE FC VILLA '99 U19 Girls EDP","U19","Girls",1
"HOLMDEL FC MILAN U16 Boys EDP","U16","Boys",1
"HOLMDEL FC NJX JUVENTUS U13 Boys EDP","U13","Boys",1
"HOLMDEL FC NJX VALENCIA U15 Boys EDP","U15","Boys",1
"HORSHAM HEAT U13 Boys EDP","U13","Boys",1
"HOWELL UNITED SC ARSENAL U15 Boys EDP","U15","Boys",1
"HULMEVILLE SC FREEDOM U14 Girls EDP","U14","Girls",1
"HULMEVILLE SC HORNETS U16 Boys EDP","U16","Boys",1
"IRONBOUND SC 04RED-BARCA U14 Boys EDP","U14","Boys",1
"IRONBOUND SC 05RED-SUPER EAGLES U13 Boys EDP","U13","Boys",1
"IRONBOUND SC 06 BLUE - GLADIATORS U12 Boys EDP","U12","Boys",1
"JERSEY CREW SC CHEETAHS U12 Girls EDP","U12","Girls",1
"JERSEY CREW SC VENOM U15 Boys EDP","U15","Boys",1
"JOGA SC JOGA 2003/2004 U15 Boys EDP","U15","Boys",1
"KEARNY UNITED ELITE U14 Boys EDP","U14","Boys",1
"KEYSTONE ATHLETIC 01 GRIFO GIRLS BLACK U17 Girls EDP","U17","Girls",1
"KEYSTONE ATHLETIC 2007 GRIFOS U11 Boys EDP","U11","Boys",1
"KEYSTONE ATHLETIC KA CLASSIC GIRLS 2003 U15 Girls EDP","U15","Girls",1
"KEYSTONE ATHLETIC U14 BOYS GRIFOS U14 Boys EDP","U14","Boys",1
"KINGS PARK X-TREME U11 Boys EDP","U11","Boys",1
"KIRKWOOD 06 WHITE U12 Boys EDP","U12","Boys",1
"LAKEHURST MANCHESTER SA BLUE STORM U14 Girls EDP","U14","Girls",1
"LAUREL LIONS WHITE U15 Boys EDP","U15","Boys",1
"LAWRENCE HAMNETT SA LIONS U16 Boys EDP","U16","Boys",1
"LIGHTHOUSE SC ATTACK U17 Boys EDP","U17","Boys",1
"LIGHTHOUSE SC RANGERS U15 Boys EDP","U15","Boys",1
"LIGHTHOUSE SOCCER 2002'S U16 Boys EDP","U16","Boys",1
"LIVERPOOL FCIA REDS U17 Boys EDP","U17","Boys",1
"LIVERPOOL FCIA WESTERN MARYLAND LFC 2002B U16 Boys EDP","U16","Boys",1
"LONG ISLAND PREMIER FC BOYS '07 U11 Boys EDP","U11","Boys",1
"LONG ISLAND SC BOYS 2002 U16 Boys EDP","U16","Boys",1
"LOWER MERION LMSC AVENGERS U17 Girls EDP","U17","Girls",1
"LOWER MERION SC PRIDE U16 Girls EDP","U16","Girls",1
"LOWER MERION SOCHERS U14 Girls EDP","U14","Girls",1
"LTSC 2002 UNITED U16 Boys EDP","U16","Boys",1
"LTSC 2005 (GREEN) U13 Boys EDP","U13","Boys",1
"LTSC 2005 (WHITE) U13 Girls EDP","U13","Girls",1
"LTSC 2006 THUNDER (PURPLE) U12 Girls EDP","U12","Girls",1
"LYNBROOK/EAST ROCKAWAY SC STING U16 Boys EDP","U16","Boys",1
"MAINLAND UNITED SA UNION U16 Boys EDP","U16","Boys",1
"MANALAPAN HEAT U19 Boys EDP","U19","Boys",1
"MANALAPAN MAYHEM U19 Girls EDP","U19","Girls",1
"MANALAPAN REVOLUTION U15 Boys EDP","U15","Boys",1
"MANHATTAN SC FREEDOM U13 Boys EDP","U13","Boys",1
"MARLTON SC LIGHTNING PREMIER 03 U15 Boys EDP","U15","Boys",1
"MAROONS SC 02-03 U16 Boys EDP","U16","Boys",1
"MARYLAND RUSH NERO 01 U17 Boys EDP","U17","Boys",1
"MARYLAND RUSH RUSH 00G NPL U18 Girls EDP","U18","Girls",1
"MARYLAND RUSH RUSH 01G NPL U17 Girls EDP","U17","Girls",1
"MARYLAND UNITED FC 2004 PREMIER U14 Boys EDP","U14","Boys",1
"MATRIX MAVERICKS U12 Boys EDP","U12","Boys",1
"MD RUSH MONTGOMERY '02G DRAGONS U16 Girls EDP","U16","Girls",1
"MD RUSH MONTGOMERY BLUE '02G U16 Girls EDP","U16","Girls",1
"MD RUSH MONTGOMERY RUSH '01G U17 Girls EDP","U17","Girls",1
"MD RUSH MONTGOMERY RUSH BLUE '02B U16 Boys EDP","U16","Boys",1
"MEDFORD SC UNITED U13 Girls EDP","U13","Girls",1
"MEDFORD STRIKERS ACADEMY U16 Boys EDP","U16","Boys",1
"MERAKI F.C. PRE ACADEMY 2004 U14 Boys EDP","U14","Boys",1
"MET OVAL 2001B U17 Boys EDP","U17","Boys",1
"MILLVILLE SA MILLVILLE PRIDE U15 Girls EDP","U15","Girls",1
"MONMOUTH UNITED SC SHARKS U16 Boys EDP","U16","Boys",1
"MONROE TOWNSHIP YS BRITTAINIA 06 U12 Girls EDP","U12","Girls",1
"MONROE TOWNSHIP YS UNITED 02 U16 Girls EDP","U16","Girls",1
"MRM RUSH NERO U17 Boys EDP","U17","Boys",1
"MT OLIVE SC PREMIER 2002 RED U16 Boys EDP","U16","Boys",1
"MT OLIVE SC PREMIER BLACK 01 U17 Boys EDP","U17","Boys",1
"NASA UNITED AC MILAN U13 Boys EDP","U13","Boys",1
"NASA UNITED ATLETICO MADRID U12 Boys EDP","U12","Boys",1
"NEW JERSEY RUSH 03 GIRLS GREY U15 Girls EDP","U15","Girls",1
"NEW YORK RED BULLS RDS NJ 07 U11 Boys EDP","U11","Boys",1
"NEW YORK SC ELITE G07 EDP U11 Girls EDP","U11","Girls",1
"NEW YORK SURF B04 LI U14 Boys EDP","U14","Boys",1
"NEW YORK SURF SC GOLDEN TOUCH 99B ACADEMY U19 Boys EDP","U19","Boys",1
"NEXT LEVEL SA 05 GIRLS U13 Girls EDP","U13","Girls",1
"NIRVANA 360 FC '01 U17 Boys EDP","U17","Boys",1
"NIRVANA 360 FC CITY '00 U19 Boys EDP","U19","Boys",1
"NIRVANA 360 MILAN 03 U15 Boys EDP","U15","Boys",1
"NJ STALLIONS ACADEMY 04 ROMA EDP U14 Boys EDP","U14","Boys",1
"NJ WILDCATS WAVE UNITED U15 Boys EDP","U15","Boys",1
"NLS AJAX 00 U18 Boys EDP","U18","Boys",1
"NLS AJAX 01 U17 Boys EDP","U17","Boys",1
"NY STARS PREMIER COMETS U15 Boys EDP","U15","Boys",1
"NY STARS PREMIER PEGASUS U16 Boys EDP","U16","Boys",1
"NY XTREME FC NYXFC05G U13 Girls EDP","U13","Girls",1
"OBGC FREEDOM BLUE U17 Girls EDP","U17","Girls",1
"OBGC RANGERS BLUE U16 Boys EDP","U16","Boys",1
"OCEAN TOWNSHIP UNITED SA 01 ELITE RED U17 Boys EDP","U17","Boys",1
"OCEAN TOWNSHIP UNITED SA 01/02 ELITE WHITE U17 Boys EDP","U17","Boys",1
"OCEAN TOWNSHIP UNITED SA 02 ELITE U16 Boys EDP","U16","Boys",1
"OCEAN UNITED SA HURRICANES U16 Girls EDP","U16","Girls",1
"OCEAN UNITED SA TITANS - RED U13 Boys EDP","U13","Boys",1
"OCEANSIDE UNITED SC STRIKERS U16 Boys EDP","U16","Boys",1
"OLD BRIDGE GIRLS SOCCER IMPACT U11 Girls EDP","U11","Girls",1
"OPSA MAGIC U15 Girls EDP","U15","Girls",1
"PA RUSH ACADEMY 06 U12 Girls EDP","U12","Girls",1
"PA RUSH NERO BLUE 04 U14 Girls EDP","U14","Girls",1
"PACHUCA FC USA DRAGONS 02 U16 Boys EDP","U16","Boys",1
"PACHUCA FC USA PACHUCA UFC '99 U19 Boys EDP","U19","Boys",1
"PARKLAND AREA PASC RED DEVILS U16 Boys EDP","U16","Boys",1
"PARSIPPANY SC 2002 WHITE U16 Boys EDP","U16","Boys",1
"PASADENA THUNDER U14 Girls EDP","U14","Girls",1
"PASCO THUNDER U13 Boys EDP","U13","Boys",1
"PATRIOT FC RED U13 Girls EDP","U13","Girls",1
"PDA DASH U11 Girls EDP","U11","Girls",1
"PDA HIBERNIAN POGBA U12 Boys EDP","U12","Boys",1
"PDA SHORE 2002 SUAREZ U16 Boys EDP","U16","Boys",1
"PDA SHORE 2003 OZIL U15 Boys EDP","U15","Boys",1
"PDA SHORE 2004 THIAGO U14 Boys EDP","U14","Boys",1
"PDA SHORE BAGGIO 2001 U17 Boys EDP","U17","Boys",1
"PDA SHORE SURF U15 Girls EDP","U15","Girls",1
"PENINSULA PREMIER EAGLES U15 Boys EDP","U15","Boys",1
"PENINSULA SC VILLA EAGLES U11 Boys EDP","U11","Boys",1
"PENINSULA UNITED EAGLES U15 Boys EDP","U15","Boys",1
"PENN FUSION SA PREACADEMY 2000 (BISSETT) U19 Girls EDP","U19","Girls",1
"PENN FUSION SA PREACADEMY 2001 (CRAIGIE) U17 Girls EDP","U17","Girls",1
"PENN FUSION SA PREACADEMY 2003 (RADU) U15 Girls EDP","U15","Girls",1
"PERFECT TOUCH SA G-2003 U15 Girls EDP","U15","Girls",1
"PHILADELPHIA UKRAINIAN NATIONALS '05 RED U13 Boys EDP","U13","Boys",1
"PHILADELPHIA UKRAINIAN NATIONALS 06 BLACK U12 Boys EDP","U12","Boys",1
"PHILADELPHIA UKRAINIAN NATIONALS 07 OLYMPYK BLACK U11 Girls EDP","U11","Girls",1
"PHILADELPHIA UKRAINIAN NATIONALS 2004 BLACK U14 Boys EDP","U14","Boys",1
"PHILADELPHIA UKRAINIAN NATIONALS VORSKLA BLACK U19 Girls EDP","U19","Girls",1
"PHILADELPHIA UKRAINIAN NATIONALS ZORIA RED U16 Boys EDP","U16","Boys",1
"PHILADELPHIA UKRAINIAN NATIONALS ZORIANY 05 BLACK U13 Girls EDP","U13","Girls",1
"PIPELINE SC BLACK U12 Girls EDP","U12","Girls",1
"PIPELINE SC BLACK U15 Boys EDP","U15","Boys",1
"PIPELINE SC GOLD U12 Boys EDP","U12","Boys",1
"PIPELINE SC RED U13 Boys EDP","U13","Boys",1
"PISCATAWAY SC LAZIO U18 Boys EDP","U18","Boys",1
"PISCATAWAY SC LAZIO U19 Boys EDP","U19","Boys",1
"PISCATAWAY SC LIVERPOOL U16 Boys EDP","U16","Boys",1
"PRINCETON FC EVERTON U18 Boys EDP","U18","Boys",1
"PRINCETON SA PREMIER ELITE 04 U14 Boys EDP","U14","Boys",1
"RANCOCAS VALLEY SC 05 UNITED U12 Boys EDP","U12","Boys",1
"READING RAGE '01 MORGAN U17 Girls EDP","U17","Girls",1
"SABA NYC G07 U11 Girls EDP","U11","Girls",1
"SAC PREMIER BLUE 05 U13 Boys EDP","U13","Boys",1
"SAC PREMIER BLUE U17 Girls EDP","U17","Girls",1
"SALISBURY UNITED SC 03 GOLD U15 Girls EDP","U15","Girls",1
"SALISBURY UNITED SC 07 GOLD U11 Boys EDP","U11","Boys",1
"SCOTCH PLAINS FANWOOD SA SPF HEATH U15 Girls EDP","U15","Girls",1
"SCOTCH PLAINS FANWOOD SA SPF MORGAN U13 Boys EDP","U13","Boys",1
"SDFC 2004B YELLOW U14 Boys EDP","U14","Boys",1
"SDFC 2005B YELLOW U13 Boys EDP","U13","Boys",1
"SDFC 2005G YELLOW U13 Girls EDP","U13","Girls",1
"SDFC 2006B BLACK U12 Boys EDP","U12","Boys",1
"SDFC 2007G YELLOW U11 Girls EDP","U11","Girls",1
"SEVERNA PARK LASERS U18 Girls EDP","U18","Girls",1
"SEVERNA PARK PREMIER GREEN U13 Boys EDP","U13","Boys",1
"SEVERNA PARK REIGN U19 Boys EDP","U19","Boys",1
"SFL DONOVAN U11 Boys EDP","U11","Boys",1
"SFL REVOLUTION U14 Boys EDP","U14","Boys",1
"SILVER LAKE SA FREEDOM U11 Girls EDP","U11","Girls",1
"SJEB RUSH 04 GIRLS PREMIER BLUE U14 Girls EDP","U14","Girls",1
"SJEB RUSH 04 GIRLS PREMIER WHITE U14 Girls EDP","U14","Girls",1
"SJEB RUSH 05 GIRLS PREMIER BLUE U13 Girls EDP","U13","Girls",1
"SOMERSET COUNTY FC PIT 00B U19 Boys EDP","U19","Boys",1
"SOMERSET COUNTY FC PIT 01B U17 Boys EDP","U17","Boys",1
"SOMERSET COUNTY FC PIT 02B U16 Boys EDP","U16","Boys",1
"SPANISH AMERICAN FOOTBALL ACADEMY ATHLETIC BILBAO U12 Boys EDP","U12","Boys",1
"SPANISH AMERICAN FOOTBALL ACADEMY BARCA U14 Boys EDP","U14","Boys",1
"SPORTING PREMIER FC SCP  FORCE 05 U13 Girls EDP","U13","Girls",1
"SPORTING PREMIER SCP 2004 U14 Boys EDP","U14","Boys",1
"ST. JOHN VIANNEY WILDCATS U17 Girls EDP","U17","Girls",1
"ST. MARY'S SOCCER OSPREYS U18 Girls EDP","U18","Girls",1
"ST. THOMAS MORE SC RED DEVILS U17 Boys EDP","U17","Boys",1
"STA 2003G EDP U15 Girls EDP","U15","Girls",1
"STA 2006G EDP U12 Girls EDP","U12","Girls",1
"STA 2007G U11 Girls EDP","U11","Girls",1
"STA-MUSC 2004G NPL U14 Girls EDP","U14","Girls",1
"STA-MUSC 2005G NPL U13 Girls EDP","U13","Girls",1
"STA-MUSC 2007B NPL U11 Boys EDP","U11","Boys",1
"STATELINE SC 03 WILD U15 Boys EDP","U15","Boys",1
"STATEN ISLAND YOUNG STARS U16 Boys EDP","U16","Boys",1
"SubDiv A Team 3 U11 Boys EDP","U11","Boys",1
"SubDiv A Team 3 U13 Boys EDP","U13","Boys",1
"SubDiv A Team 4 U12 Boys EDP","U12","Boys",1
"SubDiv A Team 4 U13 Boys EDP","U13","Boys",1
"SubDiv A Team 4 U14 Boys EDP","U14","Boys",1
"SUMMIT SC SUMMIT CITY U12 Boys EDP","U12","Boys",1
"SWSA CYCLONES U17 Boys EDP","U17","Boys",1
"TBA U13 Boys EDP","U13","Boys",1
"TBA U15 Girls EDP","U15","Girls",1
"TITANES DELFINES U13 Boys EDP","U13","Boys",1
"TOCA JUNIORS FC HUSKIES U17 Boys EDP","U17","Boys",1
"TOMS RIVER FUTBOL ATHLETICO U15 Boys EDP","U15","Boys",1
"TOMS RIVER INDEPENDENT SC TRIC ELITE BOYS 2002 REBELS U16 Boys EDP","U16","Boys",1
"TSF ACADEMY 2001G U16 Girls EDP","U16","Girls",1
"TWIN COUNTY SA SPIRIT 2002 U16 Girls EDP","U16","Girls",1
"UNION CITY UNITED SOCCER FC UNITED ANTONIO SFC U15 Boys EDP","U15","Boys",1
"UNION CITY UNITED SOCCER FC UNITED JORGE U-12 U12 Boys EDP","U12","Boys",1
"UNION COUNTY FC PREMIER UCFC BASEL U15 Girls EDP","U15","Girls",1
"UNIVERSAL USC 04 U14 Boys EDP","U14","Boys",1
"UPPER FREEHOLD/ ALLENTOWN SA (NJ) UFA FORCE U16 Boys EDP","U16","Boys",1
"UPPER FREEHOLD/ALLENTOWN SA TORNADOS U12 Boys EDP","U12","Boys",1
"UPPER FREEHOLD/ALLENTOWN SA UFA ELITE U16 Girls EDP","U16","Girls",1
"VALENCIA 05B BLACK U13 Boys EDP","U13","Boys",1
"VALENCIA 06 ORANGE U12 Boys EDP","U12","Boys",1
"VISTULA GARFIELD FLAMEKICKERS U13 Girls EDP","U13","Girls",1
"VISTULA GARFIELD ROYALS U14 Boys EDP","U14","Boys",1
"VISTULA GARFIELD STARS U12 Boys EDP","U12","Boys",1
"VITESSE FC WONDER U15 Girls EDP","U15","Girls",1
"VOORHEES SA FURY U19 Boys EDP","U19","Boys",1
"VOORHEES SA UNITED FC U19 Girls EDP","U19","Girls",1
"WARRINGTON SC FC FUSION U15 Girls EDP","U15","Girls",1
"WARRINGTON WHITE WILDCATS U16 Girls EDP","U16","Girls",1
"WARWICK SOCCER STRIKEFORCE 2006 U12 Boys EDP","U12","Boys",1
"WASHINGTON UNITED FEVER 03 U15 Girls EDP","U15","Girls",1
"WASHINGTON UNITED FURY 04 ELITE U14 Boys EDP","U14","Boys",1
"WATCHUNG HILLS NJ ELITE 2002G FUSION U16 Girls EDP","U16","Girls",1
"WAYNE BOYS AND GIRLS MESSERCOLA U14 Boys EDP","U14","Boys",1
"WAYNE SC MILAN 2005-2006 U13 Boys EDP","U13","Boys",1
"WEST NEW YORK S.C. WNY TIGER 01-02 U17 Boys EDP","U17","Boys",1
"WEST-MONT UNITED SA PREMIER BLUE '03 U15 Girls EDP","U15","Girls",1
"WEST-MONT UNITED SA UNITED 2007 U11 Girls EDP","U11","Girls",1
"WESTCHESTER FLAMES 01 U17 Boys EDP","U17","Boys",1
"WESTCHESTER FLAMES 02 BOYS U16 Boys EDP","U16","Boys",1
"WESTERN LEHIGH UNITED FIRE U12 Boys EDP","U12","Boys",1
"WESTFIELD SA UNION COUNTY FC PREMIER PUMAS U13 Boys EDP","U13","Boys",1
"WORLD CLASS FC '06 NJ RED U12 Boys EDP","U12","Boys",1
"WORLD CLASS FC '06 NJ RED U12 Girls EDP","U12","Girls",1
"XAFC NJ WHITE U14 Boys EDP","U14","Boys",1
"YMS HEAT U16 Girls EDP","U16","Girls",1
"YMS PREMIER CELTIC 00 U19 Boys EDP","U19","Boys",1
