"Home","Away","Field","Age.Group","Gender"
"PARSIPPANY SC 2006 GIRLS BLUE U12 Girls EDP","EBSC CRUSH 06G U12 Girls EDP","Reynolds #1","U12","Girls"
"NEW JERSEY RUSH 06 GREY U12 Girls EDP","PHILADELPHIA UKRAINIAN NATIONALS 06 DNIPRO RED U12 Girls EDP","Gloucester Twp Community Park B","U12","Girls"
"FC BERNA LEGACY 06G U12 Girls EDP","NJ CRUSH FC FURY U12 Girls EDP","Gill Saint Bernard's - Turf","U12","Girls"
"BROOKLYN CITY F.C. 2006 U12 Girls EDP","JERSEY CREW SC CHEETAHS U12 Girls EDP","Aviator Sports Complex #2","U12","Girls"
"FC COPA ACADEMY G06 RED U12 Girls EDP","PRINCETON SA PREMIER ELITE 06 WHITE U12 Girls EDP","Unassigned","U12","Girls"
"CAPE EXPRESS SC 2006 GIRLS WHITE U12 Girls EDP","HAMILTON ELITE FC PRE-ACADEMY 06 BLUE ANGELS U12 Girls EDP","Goshen - Davies Complex #1","U12","Girls"
"DELAWARE UNION 06/07 GIRLS U12 Girls EDP","WASHINGTON UNITED FEVER 2006 U12 Girls EDP","MV #2","U12","Girls"
"SCOTCH PLAINS FANWOOD SA SPF RAMPONE U12 Girls EDP","SFL LLOYD U12 Girls EDP","SPFSA - Ponderosa #1","U12","Girls"
"SAC UNITED BLUE U12 Girls EDP","BETHESDA SC ACADEMY BLUE 06 U12 Girls EDP","Covenant Park Field 1B","U12","Girls"
"TOWSON UNITED THUNDER U12 Girls EDP","PREMIER SC FORCE U12 Girls EDP","Boys Latin School of Maryland Grass","U12","Girls"
"HORSHAM HURRICANES 06 U12 Girls EDP","WEST-MONT UNITED SA UNION 2006 U12 Girls EDP","Lakeside School #1","U12","Girls"
"COUNCIL ROCK UNITED FC BUCKS WARRIORS U12 Girls EDP","METHACTON UNITED BLUE CRUSH U12 Girls EDP","Council Rock South 9v9 (Horse Farm Field) #12","U12","Girls"
"SJEB 2006 LAZIO U12 Girls EDP","LOWER MERION IMPACT U12 Girls EDP","Tuckahoe (9v9) #6","U12","Girls"
"SAC PREMIER BLUE 06G U12 Girls EDP","MD RUSH MONTGOMERY ACADEMY COYOTES BLUE '06G U12 Girls EDP","Covenant Park Field 5B","U12","Girls"
"CEDAR STARS ACADEMY MONMOUTH G-2006 WHITE U12 Girls EDP","PHILADELPHIA UKRAINIAN NATIONALS 2006G BLACK U12 Girls EDP","Capelli Sport Complex (Wayside Rd) #6 SS A","U12","Girls"
"SEVERNA PARK VENOM U12 Girls EDP","KEYSTONE FC PREMIER 06G U12 Girls EDP","Kinder Park Upper Field B","U12","Girls"
"WEST MORRIS SC PREMIER 06G U12 Girls EDP","EUROPA LIONS FC 2006G BLUE U12 Girls EDP","Ralston Upper","U12","Girls"
"EDISON UNITED SA REAL BLAST U12 Girls EDP","NJ CRUSH FC FURY U12 Girls EDP","Spencer Rockman Complex","U12","Girls"
"GPS NJ CENTRAL 06G WHITE U12 Girls EDP","BROOKLYN CITY F.C. 2006 U12 Girls EDP","Raritan Valley Community College","U12","Girls"
"HOLMDEL FC NJX FLASH U12 Girls EDP","CEDAR STARS ACADEMY MONMOUTH G 2006 BLACK U12 Girls EDP","Cross Farm #7","U12","Girls"
"MONROE TOWNSHIP SC UNITY U12 Girls EDP","MARLBORO SA 2006 PANTHERS BLUE U12 Girls EDP","Ave K Veterans Park #1","U12","Girls"
"MONMOUTH UNITED SC PHOENIX 06 U12 Girls EDP","GPS NJ MARLTON 06G U12 Girls EDP","West Front","U12","Girls"
"CAPE EXPRESS SC 2006 GIRLS WHITE U12 Girls EDP","FC COPA ACADEMY G06 RED SOUTH U12 Girls EDP","Goshen - Davies Complex #1","U12","Girls"
"MEDFORD STRIKERS SC PRIDE U12 Girls EDP","GPS NJ SOUTH 06 GIRLS U12 Girls EDP","Medford Strikers","U12","Girls"
"METHACTON UNITED BLUE CRUSH U12 Girls EDP","HARLEYSVILLE FC RANGERS 06G U12 Girls EDP","Sunnybrook Park #1","U12","Girls"
"CONNECTICUT FC CFC CHELSEA U12 Girls EDP","BLACK ROCK FC 2006 GIRLS U12 Girls EDP","Choate Fields","U12","Girls"
"PRINCETON SA PREMIER ELITE 06 ORANGE U12 Girls EDP","CEDAR STARS ACADEMY BERGEN 2006 GIRLS BLACK U12 Girls EDP","Greenway Meadows Park SS Â","U12","Girls"
"SEVERNA PARK VENOM U12 Girls EDP","NLS ATHENA 06 U12 Girls EDP","Kinder Park Upper Field B","U12","Girls"
"COUNCIL ROCK UNITED FC BUCKS CYCLONES U12 Girls EDP","PHILADELPHIA UKRAINIAN NATIONALS 06 DNIPRO RED U12 Girls EDP","Big Meadow 9v9 #1","U12","Girls"
"MARLBORO SA 2006 PANTHERS BLUE U12 Girls EDP","HOLMDEL FC STAMPEDE U12 Girls EDP","Vanderburg #15","U12","Girls"
"FISHTOWN AC FUSION 06/07 U12 Girls EDP","MILLBURN STARS U12 Girls EDP","Shissler Rec","U12","Girls"
"U.S. PARMA GOLD 06 U12 Girls EDP","MT OLIVE SC PREMIER MONACO U12 Girls EDP","The Wardlaw-Hartridge School Rear SS Turf #1","U12","Girls"
"PDA LIGHTNING U12 Girls EDP","COUNCIL ROCK UNITED FC BUCKS WARRIORS U12 Girls EDP","PDA","U12","Girls"
"MIDDLETOWN SC MILAN RED U12 Girls EDP","REAL JERSEY FC 2006 U12 Girls EDP","Thompson SS","U12","Girls"
"PLAYERS EYE FC GIRLS 2006 U12 Girls EDP","CEDAR STARS ACADEMY HUDSON VALLEY 2006 U12 Girls EDP","Yorktown Sports Complex #1","U12","Girls"
"HULMEVILLE FORCE U12 Girls EDP","HORSHAM HURRICANES 06 U12 Girls EDP","Grace Episcopal Church Field","U12","Girls"
"MATCH FIT MONTCLAIR UNITED 2006 GIRLS U12 Girls EDP","EAST HANOVER PESA TORCIDA U12 Girls EDP","Brookdale Meadow Large BML","U12","Girls"
"MONROE TOWNSHIP SC UNITY U12 Girls EDP","OCEAN UNITED SA FURY RED U12 Girls EDP","Ave K Veterans Park #1","U12","Girls"
"MONMOUTH UNITED SC PHOENIX 06 U12 Girls EDP","CHERRY HILL FC JUNIOR PREMIER 06 U12 Girls EDP","West Front","U12","Girls"
"CEDAR STARS ACADEMY BERGEN 2006 GIRLS BLACK U12 Girls EDP","STA 2006G NPL U12 Girls EDP","Unassigned","U12","Girls"
"PDA LIGHTNING U12 Girls EDP","COUNCIL ROCK UNITED FC BUCKS CYCLONES U12 Girls EDP","PDA Zarepath #1","U12","Girls"
"CEDAR STARS ACADEMY BEGEN 2006 GREEN U12 Girls EDP","CENTERCOURT FC 06 GREEN'S U12 Girls EDP","Overpeck #1","U12","Girls"
"PRINCETON SA PREMIER ELITE 06 ORANGE U12 Girls EDP","LIVERPOOL FCIA REDS U12 Girls EDP","Unassigned","U12","Girls"
"FC SPORTIKA ACADEMY 2006G U12 Girls EDP","WESTFIELD SA UNION COUNTY FC PREMIER SAO PAULO U12 Girls EDP","Sportika Sports","U12","Girls"
"EASTERN PIKE SC REVOLUTION U12 Girls EDP","NIRVANA 360 FREEDOM U12 Girls EDP","7th Street Field #1","U12","Girls"
"PASCO TIMBERS U12 Girls EDP","BROOKLYN CITY F.C. 2006 U12 Girls EDP","GOFFLE BROOK PARK","U12","Girls"
"DEPTFORD PREMIER FC '06 GIRLS U12 Girls EDP","HOLMDEL FC STAMPEDE U12 Girls EDP","Cattell Complex in Deptford #1","U12","Girls"
"CHERRY HILL SC ROAR U12 Girls EDP","GPS NJ SOUTH 06 GIRLS U12 Girls EDP","Chapel Ave Turf","U12","Girls"
"MEDFORD STRIKERS SC PRIDE U12 Girls EDP","DELRAN THUNDER U12 Girls EDP","Medford Strikers","U12","Girls"
"MT OLIVE SC PREMIER MONACO U12 Girls EDP","WIZARDS SPORTS ISTA ELITE U12 Girls EDP","Turkey Brook Park #2","U12","Girls"
"PRINCETON SA PREMIER ELITE 06 ORANGE U12 Girls EDP","CENTERCOURT FC 06G GREEN U12 Girls EDP","Greenway Meadows Park","U12","Girls"
"CENTERCOURT FC 06G GREEN U12 Girls EDP","CEDAR STARS ACADEMY BERGEN 2006 GIRLS BLACK U12 Girls EDP","Riverside Park","U12","Girls"
"U.S. PARMA GOLD 06 U12 Girls EDP","SCOTCH PLAINS FANWOOD SA SPF RAMPONE U12 Girls EDP","Wardlaw Hartridge HS Turf #1","U12","Girls"
"PRINCETON SA PREMIER ELITE 06 ORANGE U12 Girls EDP","NJ WILDCATS ADAMS-NPL U12 Girls EDP","Unassigned","U12","Girls"
"HAMILTON ELITE FC PRE-ACADEMY 06 BLUE ANGELS U12 Girls EDP","BORDENTOWN COMMUNITY SA STORM U12 Girls EDP","Hickory St Soccer 2 SS","U12","Girls"
"PENN FUSION SA PREACADEMY 2006 (EDWARDS) U12 Girls EDP","SJEB 2006 LAZIO U12 Girls EDP","KildaresPubWC-Turf Field #1","U12","Girls"
"WATCHUNG HILLS NJ ELITE 2007G FORCE U12 Girls EDP","CEDAR STARS ACADEMY BEGEN 2006 GREEN U12 Girls EDP","Kantor Park","U12","Girls"
"LEHIGH VALLEY UNITED LVU 2006 GIRLS BLACK U12 Girls EDP","SUMMIT SC FREEDOM U12 Girls EDP","Lehigh County Sports Fields #2","U12","Girls"
"MORRIS ELITE 06G EDP U12 Girls EDP","FREEHOLD SL STORM U12 Girls EDP","Niles Field #1","U12","Girls"
"NIRVANA 360 FREEDOM U12 Girls EDP","CENTERCOURT FC 06 GIRLS BLUE U12 Girls EDP","Hamptonburgh #1","U12","Girls"
"HOLMDEL FC NJX FLASH U12 Girls EDP","GPS NJ CLEARVIEW 06G U12 Girls EDP","Cross Farm #11","U12","Girls"
"SCOTCH PLAINS FANWOOD SA SPF RAMPONE U12 Girls EDP","EASTERN PIKE SC REVOLUTION U12 Girls EDP","SPFSA - Ponderosa #1","U12","Girls"
"HILLSBOROUGH 06G RAIDERS RED U12 Girls EDP","WORLD CLASS FC '06 PALAU U12 Girls EDP","Hillsborough SC - Southwoods Rd #2","U12","Girls"
"WORLD CLASS FC '06 NJ RED U12 Girls EDP","CENTERCOURT FC 06G GREEN U12 Girls EDP","World Class FC/Waldwick SuperDome #1","U12","Girls"
"CEDAR STARS ACADEMY BEGEN 2006 GREEN U12 Girls EDP","SDFC 2006G YELLOW U12 Girls EDP","Overpeck #1","U12","Girls"
"SUMMIT SC FREEDOM U12 Girls EDP","FREEHOLD SL STORM U12 Girls EDP","Opatut West 5B","U12","Girls"
"MILLBURN STARS U12 Girls EDP","MORRIS ELITE 06G EDP U12 Girls EDP","Millburn High School","U12","Girls"
"CENTERCOURT FC 06 GIRLS BLUE U12 Girls EDP","EASTERN PIKE SC REVOLUTION U12 Girls EDP","Riverside Park","U12","Girls"
"CEDAR STARS ACADEMY MONMOUTH G 2006 BLACK U12 Girls EDP","GPS NJ CLEARVIEW 06G U12 Girls EDP","Capelli Sport Field at Sycamore Recreation Complex #5 SS A","U12","Girls"
"CHERRY HILL SC ROAR U12 Girls EDP","MEDFORD STRIKERS SC PRIDE U12 Girls EDP","Chapel Ave Turf","U12","Girls"
"MATCH FIT MONTCLAIR UNITED 2006 GIRLS U12 Girls EDP","EDISON UNITED SA REAL BLAST U12 Girls EDP","Brookdale Meadow Large BML","U12","Girls"
"NEW YORK SC ELITE G06 EDP U12 Girls EDP","CEDAR STARS ACADEMY BEGEN 2006 GREEN U12 Girls EDP","Unassigned","U12","Girls"
"SCOTCH PLAINS FANWOOD SA SPF MORGAN U13 Girls EDP","SPORTING PREMIER FC SCP  FORCE 05 U13 Girls EDP","SPFSA - Southside #1","U13","Girls"
"TSF ACADEMY 2005G U13 Girls EDP","WORLD CLASS FC '06 X-TREME U13 Girls EDP","","U13","Girls"
"AC CUGINI ROMA 05 U13 Girls EDP","SYC PHOENIX RED U13 Girls EDP","Marriotts Ridge High School stadium","U13","Girls"
"CONNECTICUT FOOTBALL 2005 SOUND U13 Girls EDP","SUSA ELITE G05 U13 Girls EDP","Hamden Hall Country Day School - Beckerman Athletic Fields (Back Turf Field) #1","U13","Girls"
"GPS NJ SOUTH 05G U13 Girls EDP","WATCHUNG HILLS 05G EDP SAMBA U13 Girls EDP","Tyler Davis Fields","U13","Girls"
"FC EUROPA 05G ELITE U13 Girls EDP","PA RUSH 05G U13 Girls EDP","Delaware Valley Friends School DVFS","U13","Girls"
"PREMIER NAVY 05 U13 Girls EDP","MARYLAND RUSH RUSH 05G U13 Girls EDP","Notre Dame Prep School #1","U13","Girls"
"BALTIMORE UNION ELITE 05G U13 Girls EDP","HERNDON YOUTH SOCCER HYS FORCE 05 (FORMERLY RESTON FORCE BLUE O5) U13 Girls EDP","Honeygo Run Park Turf","U13","Girls"
"PERFECT TOUCH SA G-2005 U13 Girls EDP","B'ELITE PLAYER DEVELOPMENT SC 2005 U13 Girls EDP","Todd ES Grass","U13","Girls"
"FC COPA ACADEMY G05 BLACK SOUTH U13 Girls EDP","LAWRENCE HAMNETT SA CHEETAHS U13 Girls EDP","Rowan Univ. West Campus Turf","U13","Girls"
"HARLEYSVILLE FC READY '05G U13 Girls EDP","MEDFORD SC UNITED U13 Girls EDP","Alderfer A1","U13","Girls"
"HADDONFIELD SC 05 UNITED U13 Girls EDP","FC COPA ACADEMY G05 BLACK U13 Girls EDP","Crows Woods 1-4","U13","Girls"
"FC EUROPA 2006 ELITE U13 Girls EDP","CONTINENTAL FC DORTMUND '06F U13 Girls EDP","CEDAR HOLLOW","U13","Girls"
"HOLMDEL FC NJX REIGN U13 Girls EDP","ELIZABETH YSC REVOLUTION U13 Girls EDP","Cross Farm #3","U13","Girls"
"WEST MORRIS SC PREMIER 05 RED U13 Girls EDP","CEDAR STARS ACADEMY STATEN ISLAND 2005 DELS U13 Girls EDP","Ralston Upper #13","U13","Girls"
"CENTERCOURT FC 05 GREEN U13 Girls EDP","WATCHUNG HILLS NJ ELITE 2005G LEEUWIN U13 Girls EDP","RIverside Park Turf Field #1","U13","Girls"
"PHILADELPHIA SC COPPA RAGE 05 U13 Girls EDP","PHILADELPHIA UKRAINIAN NATIONALS ZORIANY 05 BLACK U13 Girls EDP","PSC/Agusta A4","U13","Girls"
"HADDONFIELD SC 05 UNITED U13 Girls EDP","DELAWARE FOOTBALL DEFC 05 GIRLS U13 Girls EDP","Crows Woods 1-4","U13","Girls"
"BALTIMORE CELTIC SC DYNAMOS U13 Girls EDP","MARYLAND UNITED FC 2005 PREMIER U13 Girls EDP","Cardinal Gibbons School Babe Ruth","U13","Girls"
"NEW YORK SC ELITE G05 EDP U13 Girls EDP","BEACHSIDE OF CONNECTICUT SC GIRLS 2005 U13 Girls EDP","Manhattanville College","U13","Girls"
"NEW JERSEY RUSH 05 GIRLS GREY U13 Girls EDP","WSC ELITE STRIKERS U13 Girls EDP","Notre Dame High School (Turf)","U13","Girls"
"PENN FUSION SA ELITE 2005 (BARRY) U13 Girls EDP","PENN LEGACY 05 BLACK F U13 Girls EDP","Penn Fusion Delacy Soccer Complex #3","U13","Girls"
"WASHINGTON UNITED FEVER 05 U13 Girls EDP","WEST-MONT UNITED SA UNITED 2005 U13 Girls EDP","WLP #4","U13","Girls"
"HARFORD FC UNITED SPIRIT U13 Girls EDP","FREEDOM DYNAMITE RED U13 Girls EDP","C. Milton Wright High School (Turf) #3","U13","Girls"
"PRINCETON SA PREMIER 05 NORTH U13 Girls EDP","FC BERNA LEGACY 05G U13 Girls EDP","Lewis Cole Middle School","U13","Girls"
"WESTFIELD SA UNION COUNTY FC PREMIER TOLUCA U13 Girls EDP","CENTERCOURT FC 05 BLUE U13 Girls EDP","Houlihan","U13","Girls"
"OCEAN UNITED SA FEVER U13 Girls EDP","LOWER MERION FORCE U13 Girls EDP","Ocean Twp - HS JV","U13","Girls"
"MATCH FIT ACADEMY FC MERCER 05 U13 Girls EDP","VISTULA GARFIELD FLAMEKICKERS U13 Girls EDP","Mercer County College Turf","U13","Girls"
"HARFORD FC UNITED FUSION U13 Girls EDP","FC BORDEAUX USA 05 U13 Girls EDP","C. Milton Wright High School (Turf) #3","U13","Girls"
"FREEHOLD SL FURY U13 Girls EDP","MEDFORD STRIKERS MYSTIC U13 Girls EDP","Jackson Mills JM1","U13","Girls"
"NJ WILDCATS MAD DOGS U13 Girls EDP","MONROE TOWNSHIP YS UNITED 05 PANTHERS U13 Girls EDP","Manahassett Creek Park #1","U13","Girls"
"TSF ACADEMY 2005G U13 Girls EDP","ARSENAL SOCCER SCHOOLS ACADEMY 05/06 LADIES U13 Girls EDP","DePaul High School #1","U13","Girls"
"CEDAR STARS ACADEMY BERGEN 2005 GREEN U13 Girls EDP","FARMINGDALE SC REBELS UNITED U13 Girls EDP","Unassigned","U13","Girls"
"LTSC 2005 STRIKERS (PURPLE) U13 Girls EDP","SYC PHOENIX RED U13 Girls EDP","Orchard Hills Park #3","U13","Girls"
"SAC PREMIER BLUE 05 U13 Girls EDP","AC CUGINI ROMA 05 U13 Girls EDP","Centennial HS Stadium","U13","Girls"
"TORPEDOES SC RED - SILVA U13 Girls EDP","FC WESTCHESTRER ARMOUR GIRLS 05 U13 Girls EDP","Pulis Field A","U13","Girls"
"WEST-MONT UNITED SA UNITED 2005 U13 Girls EDP","LEHIGH VALLEY UNITED LVU 2005 GIRLS BLACK U13 Girls EDP","Hill Top #9","U13","Girls"
"PENN LEGACY 05 BLACK F U13 Girls EDP","FC EUROPA 05G ELITE U13 Girls EDP","Penn Legacy East Petersburg Campus #1","U13","Girls"
"SAC PREMIER WHITE '05 U13 Girls EDP","CALVERT CSA WARRIORS 05G U13 Girls EDP","Centennial HS Stadium","U13","Girls"
"NIRVANA 360 MYSTIQUE U13 Girls EDP","PARSIPPANY SC 2005 GIRLS BLUE U13 Girls EDP","Washingtonville High School Upper","U13","Girls"
"CEDAR STARS ACADEMY MONMOUTH G-2005 WHITE U13 Girls EDP","SCOTCH PLAINS FANWOOD SA SPF MORGAN U13 Girls EDP","Capelli Sport Complex (Wayside Rd) #3","U13","Girls"
"MD RUSH MONTGOMERY ACADEMY COYOTES GRAY '05G U13 Girls EDP","BALTIMORE UNION ELITE 05G U13 Girls EDP","Ridge Road Rec Pk Field 05","U13","Girls"
"BALTIMORE BAYS ROWDIES U13 Girls EDP","HARFORD FC UNITED FUSION U13 Girls EDP","Carsins Run Field C","U13","Girls"
"B'ELITE PLAYER DEVELOPMENT SC 2005 U13 Girls EDP","CEDAR STARS ACADEMY MORRIS COUNTY 2005 U13 Girls EDP","Garwood Sports & Recreation Complex","U13","Girls"
"GERMAN AMERICAN KICKERS BANSHEES U13 Girls EDP","MEDFORD SC UNITED U13 Girls EDP","GAK Main","U13","Girls"
"LDC UNITED LDC IMPACT 05 U13 Girls EDP","WESTERN LEHIGH UNITED 2005 GIRLS GREEN U13 Girls EDP","Lower Dauphin Middle School West Turf","U13","Girls"
"MATCH FIT MONTCLAIR UNITED 2005 GIRLS U13 Girls EDP","MATCH FIT ACADEMY FC MERCER 05 U13 Girls EDP","Brookdale Park Stadium BPS","U13","Girls"
"JERSEY SHORE BOCA JR FC BREAKERS U13 Girls EDP","HADDONFIELD SC 05 UNITED U13 Girls EDP","Jakes Branch County Park #2","U13","Girls"
"NEW YORK SURF G05 U13 Girls EDP","A-GAME 2005 U13 Girls EDP","East Woods School Upper #2","U13","Girls"
"WATCHUNG HILLS NJ ELITE 2005G LEEUWIN U13 Girls EDP","CAPS GREATER FLEMINGTON BARCELONA BLUE 05 U13 Girls EDP","Green Brook Middle School","U13","Girls"
"CEDAR STARS ACADEMY STATEN ISLAND 2005 DELS U13 Girls EDP","NJ WILDCATS O'HALLORAN-NPL U13 Girls EDP","College of Staten Island","U13","Girls"
"WESTERN LEHIGH UNITED 2005 GIRLS GREEN U13 Girls EDP","PHILADELPHIA SC COPPA RAGE 05 U13 Girls EDP","Lehigh County Large #8","U13","Girls"
"PDA SHORE FLASH U13 Girls EDP","HADDONFIELD SC 05 UNITED U13 Girls EDP","Ocean County College Grass FS","U13","Girls"
"LDC UNITED LDC IMPACT 05 U13 Girls EDP","MARYLAND UNITED FC 2005 PREMIER U13 Girls EDP","Lower Dauphin Middle School Grass #1","U13","Girls"
"BEACHSIDE OF CONNECTICUT SC GIRLS 2005 U13 Girls EDP","ARSENAL FIREWORK U13 Girls EDP","Sacred Heart University Turf","U13","Girls"
"HARRISON SC GATORS U13 Girls EDP","MATCH FIT MONTCLAIR UNITED 2005 GIRLS U13 Girls EDP","William Wilt Soccer Complex","U13","Girls"
"SDFC 2005G YELLOW U13 Girls EDP","STA 2005G EDP U13 Girls EDP","Cedar Grove HS Turf","U13","Girls"
"YMS RAGE U13 Girls EDP","WARRINGTON 2005 UNITED U13 Girls EDP","Macclesfield Park I","U13","Girls"
"SEVERNA PARK MAMBAS U13 Girls EDP","FREEDOM DYNAMITE RED U13 Girls EDP","Kinder Park Lower Field 02","U13","Girls"
"RYSA WILDCATS 2005G U13 Girls EDP","U.S. PARMA GOLD 05 U13 Girls EDP","Franklin Ave Middle School  FAMS","U13","Girls"
"NJ CRUSH FC BLITZ U13 Girls EDP","PARSIPPANY SC 2005 GIRLS BLUE U13 Girls EDP","Smith 1 Turf","U13","Girls"
"PHILADELPHIA UKRAINIAN NATIONALS ZORIANY 05 RED GIRLS U13 Girls EDP","MIDDLETOWN SC COSMOS RED U13 Girls EDP","Ukrainian Nationals Sports Complex #1","U13","Girls"
"FC BORDEAUX USA 05 U13 Girls EDP","OLFC VIPERS U13 Girls EDP","Martin Luther King Pk #4","U13","Girls"
"VALENCIA 05G BLACK U13 Girls EDP","MAGPIES SC MAGPIES GOLD U13 Girls EDP","John F Kennedy Memorial High School","U13","Girls"
"GPS NJ CENTRAL 05G U13 Girls EDP","NJ CRUSH FC IMPACT U13 Girls EDP","Raritan Valley Community College","U13","Girls"
"GPS NJ CLEARVIEW 05G U13 Girls EDP","NJ WILDCATS MAD DOGS U13 Girls EDP","William Wilt Soccer Complex A","U13","Girls"
"LAWRENCE HAMNETT SA CHEETAHS U13 Girls EDP","LAKEHURST MANCHESTER SA THUNDER U13 Girls EDP","Twin Pines","U13","Girls"
"TSF ACADEMY 2005G U13 Girls EDP","PDA WOLVES U13 Girls EDP","De Paul Catholic #1","U13","Girls"
"FC COPA ACADEMY G05 BLACK U13 Girls EDP","CEDAR STARS ACADEMY STATEN ISLAND 2005 DELS U13 Girls EDP","Rutgers-Busch University Park Turf","U13","Girls"
"MD RUSH MONTGOMERY ACADEMY COYOTES BLUE '05G U13 Girls EDP","LTSC 2005 STRIKERS (PURPLE) U13 Girls EDP","Ridge Road Rec Pk Field 05","U13","Girls"
"SYC PHOENIX RED U13 Girls EDP","MARYLAND UNITED FC 2005 PREMIER U13 Girls EDP","Franconia Park #4","U13","Girls"
"PREMIER NAVY 05 U13 Girls EDP","FREEDOM DYNAMITE RED U13 Girls EDP","Notre Dame Prep School #1","U13","Girls"
"BETHESDA SC ROWDIES 05 U13 Girls EDP","CALVERT CSA WARRIORS 05G U13 Girls EDP","Richard Montgomery HS","U13","Girls"
"PARSIPPANY SC 2005 GIRLS BLUE U13 Girls EDP","RYSA WILDCATS 2005G U13 Girls EDP","Reynolds #1","U13","Girls"
"JERSEY SHORE BOCA JR FC BREAKERS U13 Girls EDP","SCOTCH PLAINS FANWOOD SA SPF MORGAN U13 Girls EDP","Jakes Branch County Park #1","U13","Girls"
"BETHESDA SC HAWKS 05 U13 Girls EDP","WORLD CUP SA UNITED U13 Girls EDP","Richard Montgomery HS","U13","Girls"
"WAYNE BOYS AND GIRLS BATELLI U13 Girls EDP","EAST HANOVER PESA ISTRA U13 Girls EDP","Froehner Field","U13","Girls"
"JERSEY CREW SC PUMAS U13 Girls EDP","B'ELITE PLAYER DEVELOPMENT SC 2005 U13 Girls EDP","Montville Community Park #3","U13","Girls"
"LAWRENCE HAMNETT SA CHEETAHS U13 Girls EDP","GERMAN AMERICAN KICKERS BANSHEES U13 Girls EDP","Twin Pines","U13","Girls"
"PHILADELPHIA UKRAINIAN NATIONALS ZORIANY 05 BLACK U13 Girls EDP","LDC UNITED LDC IMPACT 05 U13 Girls EDP","Ukrainian Nationals Sports Complex #6","U13","Girls"
"NJ WILDCATS O'HALLORAN-NPL U13 Girls EDP","ELIZABETH YSC REVOLUTION U13 Girls EDP","Manahassett Creek Park #1","U13","Girls"
"HOLMDEL FC NJX REIGN U13 Girls EDP","WEST MORRIS SC PREMIER 05 RED U13 Girls EDP","Cross Farm #10","U13","Girls"
"WESTERN LEHIGH UNITED 2005 GIRLS GREEN U13 Girls EDP","PHILADELPHIA UKRAINIAN NATIONALS ZORIANY 05 BLACK U13 Girls EDP","Lehigh County Large #7","U13","Girls"
"HADDONFIELD SC 05 UNITED U13 Girls EDP","SJEB RUSH 05 GIRLS ACADEMY U13 Girls EDP","Haddonfield Memorial High School","U13","Girls"
"SYC PHOENIX RED U13 Girls EDP","MD RUSH MONTGOMERY ACADEMY COYOTES BLUE '05G U13 Girls EDP","South Run District Park Turf #6","U13","Girls"
"CONNECTICUT FOOTBALL 2005 SOUND U13 Girls EDP","FC WESTCHESTRER ARMOUR GIRLS 05 U13 Girls EDP","Choate Fields","U13","Girls"
"SOUTH CENTRAL PREMIER STORM U13 Girls EDP","TORPEDOES SC RED - SILVA U13 Girls EDP","CT Sportsplex #1","U13","Girls"
"PRINCETON SA PREMIER ELITE 05 U13 Girls EDP","STA 2005G EDP U13 Girls EDP","Stuart Country Day School","U13","Girls"
"YMS RAGE U13 Girls EDP","WEST-MONT UNITED SA UNITED 2005 U13 Girls EDP","Macclesfield Park F","U13","Girls"
"FC EUROPA 05G ELITE U13 Girls EDP","PENN FUSION SA ELITE 2005 (BARRY) U13 Girls EDP","The Proving Ground #3","U13","Girls"
"SAC PREMIER WHITE '05 U13 Girls EDP","CESC CALVERT ELITE '05 U13 Girls EDP","Covenant Park Field 07","U13","Girls"
"RYSA WILDCATS 2005G U13 Girls EDP","NJ CRUSH FC BLITZ U13 Girls EDP","Franklin Ave Middle School  FAMS","U13","Girls"
"U.S. PARMA GOLD 05 U13 Girls EDP","NIRVANA 360 MYSTIQUE U13 Girls EDP","The Wardlaw-Hartridge School Rear Turf Field #2","U13","Girls"
"LOWER MERION FORCE U13 Girls EDP","MARLTON SC FLAME 05 U13 Girls EDP","Polo Fields #1","U13","Girls"
"FC BORDEAUX USA 05 U13 Girls EDP","SALISBURY UNITED SC 05G GOLD U13 Girls EDP","Martin Luther King Pk #4","U13","Girls"
"BALTIMORE BAYS ROWDIES U13 Girls EDP","OLFC VIPERS U13 Girls EDP","Cedar Lane Regional Park #12 Turf","U13","Girls"
"VALENCIA 05G BLACK U13 Girls EDP","SFL FURY U13 Girls EDP","John F Kennedy Memorial High School","U13","Girls"
"MONROE TOWNSHIP YS UNITED 05 PANTHERS U13 Girls EDP","GPS NJ CLEARVIEW 05G U13 Girls EDP","Berwick Soccer Complex #1","U13","Girls"
"FC SPORTIKA ACADEMY 2005G U13 Girls EDP","MEDFORD STRIKERS MYSTIC U13 Girls EDP","Sportika Sports","U13","Girls"
"HARLEYSVILLE FC READY '05G U13 Girls EDP","VOORHEES SA FLASH U13 Girls EDP","Alderfer A1","U13","Girls"
"FARMINGDALE SC REBELS UNITED U13 Girls EDP","NEW YORK SURF G05 U13 Girls EDP","Unassigned","U13","Girls"
"ALLEYCATS ACADEMY PRE-NPL RED 2005G U13 Girls EDP","A-GAME 2005 U13 Girls EDP","Union College Park","U13","Girls"
"WEST MORRIS SC PREMIER 05 RED U13 Girls EDP","WATCHUNG HILLS NJ ELITE 2005G LEEUWIN U13 Girls EDP","Ralston Upper #13","U13","Girls"
"LTSC 2005 STRIKERS (PURPLE) U13 Girls EDP","BALTIMORE CELTIC SC DYNAMOS U13 Girls EDP","Orchard Hills Park #3","U13","Girls"
"SAC PREMIER BLUE 05 U13 Girls EDP","MD RUSH MONTGOMERY ACADEMY COYOTES BLUE '05G U13 Girls EDP","Covenant Park Field 07","U13","Girls"
"PENN FUSION SA ELITE 2005 (BARRY) U13 Girls EDP","WASHINGTON UNITED FEVER 05 U13 Girls EDP","Penn Fusion United Sports Training Center #3","U13","Girls"
"SAC PREMIER WHITE '05 U13 Girls EDP","MARYLAND RUSH RUSH 05G U13 Girls EDP","Covenant Park Field 07","U13","Girls"
"MD RUSH MONTGOMERY ACADEMY COYOTES GRAY '05G U13 Girls EDP","LTSC 2005 (WHITE) U13 Girls EDP","Ridge Road Rec Pk Field 05","U13","Girls"
"FC BORDEAUX USA 05 U13 Girls EDP","BALTIMORE BAYS ROWDIES U13 Girls EDP","Martin Luther King Pk #4","U13","Girls"
"NJ CRUSH FC IMPACT U13 Girls EDP","ARSENAL SOCCER SCHOOLS ACADEMY 05/06 LADIES U13 Girls EDP","FDU Soccer Field #1","U13","Girls"
"B'ELITE PLAYER DEVELOPMENT SC 2005 U13 Girls EDP","CENTERCOURT FC 05 WHITE U13 Girls EDP","Garwood Sports & Recreation Complex","U13","Girls"
"CEDAR STARS ACADEMY BERGEN 2005 GREEN U13 Girls EDP","ELIZABETH YSC REVOLUTION U13 Girls EDP","Unassigned","U13","Girls"
"HOLMDEL FC NJX REIGN U13 Girls EDP","SPORTING PREMIER FC SCP  FORCE 05 U13 Girls EDP","Cross Farm #1","U13","Girls"
"CEDAR STARS ACADEMY STATEN ISLAND 2005 DELS U13 Girls EDP","HOLMDEL FC NJX REIGN U13 Girls EDP","College of Staten Island","U13","Girls"
"CEDAR STARS ACADEMY MONMOUTH G-2005 GREEN U13 Girls EDP","NJ WILDCATS O'HALLORAN-NPL U13 Girls EDP","Capelli Sport Complex (Wayside Rd) #6 FS","U13","Girls"
"PHILADELPHIA UKRAINIAN NATIONALS ZORIANY 05 BLACK U13 Girls EDP","HADDONFIELD SC 05 UNITED U13 Girls EDP","Ukrainian Nationals Sports Complex #6","U13","Girls"
"PDA SHORE FLASH U13 Girls EDP","HOWELL UNITED SC FIRE U13 Girls EDP","Ocean County College Grass FS","U13","Girls"
"MARYLAND UNITED FC 2005 PREMIER U13 Girls EDP","ODFC CESENA 05G BLACK U13 Girls EDP","Indian Creek Upper School Field #1","U13","Girls"
"NEW YORK SC ELITE G05 EDP U13 Girls EDP","TORPEDOES SC RED - SILVA U13 Girls EDP","Hackley School Benedict Field #1","U13","Girls"
"BEACHSIDE OF CONNECTICUT SC GIRLS 2005 U13 Girls EDP","CONNECTICUT FOOTBALL 2005 SOUND U13 Girls EDP","Trinity High School Turf","U13","Girls"
"STA 2005G EDP U13 Girls EDP","HARRISON SC GATORS U13 Girls EDP","Central Park #3","U13","Girls"
"SDFC 2005G YELLOW U13 Girls EDP","WSC ELITE STRIKERS U13 Girls EDP","Cedar Grove HS Turf","U13","Girls"
"PA RUSH 05G U13 Girls EDP","YMS RAGE U13 Girls EDP","Rush Soccer Complex #1","U13","Girls"
"PENN LEGACY 05 BLACK F U13 Girls EDP","LEHIGH VALLEY UNITED LVU 2005 GIRLS BLACK U13 Girls EDP","Penn Legacy East Petersburg Campus #1","U13","Girls"
"CESC CALVERT ELITE '05 U13 Girls EDP","HARFORD FC UNITED SPIRIT U13 Girls EDP","Calverton School Alumni Field","U13","Girls"
"WESTFIELD SA UNION COUNTY FC PREMIER TOLUCA U13 Girls EDP","NIRVANA 360 MYSTIQUE U13 Girls EDP","Houlihan","U13","Girls"
"CENTERCOURT FC 05 BLUE U13 Girls EDP","PRINCETON SA PREMIER 05 NORTH U13 Girls EDP","Long Hill Grass Field","U13","Girls"
"DEPTFORD PREMIER FC '05 GIRLS U13 Girls EDP","OCEAN UNITED SA FEVER U13 Girls EDP","Cattell Complex in Deptford #1","U13","Girls"
"SCOTCH PLAINS FANWOOD SA SPF MORGAN U13 Girls EDP","MATCH FIT ACADEMY FC MERCER 05 U13 Girls EDP","SPFSA - Southside #1","U13","Girls"
"SALISBURY UNITED SC 05G GOLD U13 Girls EDP","HARFORD FC UNITED FUSION U13 Girls EDP","Falcon Sports Complex Field 10","U13","Girls"
"SFL FURY U13 Girls EDP","GPS NJ CENTRAL 05G U13 Girls EDP","Pingry Upper School","U13","Girls"
"FREEHOLD SL FURY U13 Girls EDP","NJ WILDCATS MAD DOGS U13 Girls EDP","Jackson Mills JM1","U13","Girls"
"CHERRY HILL FC PREMIER XTREME 05 U13 Girls EDP","FC COPA ACADEMY G05 BLACK SOUTH U13 Girls EDP","Decou D7","U13","Girls"
"WATCHUNG HILLS 05G EDP SAMBA U13 Girls EDP","SCOTCH PLAINS FANWOOD SA SPF MORGAN U13 Girls EDP","Duderstadt Turf Field","U13","Girls"
"FC BERNA LEGACY 05G U13 Girls EDP","RYSA WILDCATS 2005G U13 Girls EDP","Mountain Park","U13","Girls"
