"Home","Away","Field","Age.Group","Gender"
"VALENCIA CF ACADEMY NY 2005 BLACK U13 Boys EDP","LONG ISLAND PREMIER FC BOYS '05 U13 Boys EDP","LIU: CW Post Campus #1","U13","Boys"
"HARLEYSVILLE FC READY '05B U13 Boys EDP","YMS HIGHLANDERS 05 U13 Boys EDP","Alderfer A1","U13","Boys"
"FUSA ARSENAL U13 Boys EDP","CLARKSTOWN SC 2005 RED U13 Boys EDP","Roger Ludlowe Middle School #1","U13","Boys"
"FC COPA ACADEMY B05 BLACK U13 Boys EDP","TSF ACADEMY 2005B BLUE U13 Boys EDP","Rutgers-Busch Sport Club Turf","U13","Boys"
"PLAYERS EYE FC BOYS 2005 U13 Boys EDP","WORLD CLASS FC '05 WHITE U13 Boys EDP","Yorktown Sports Complex #1","U13","Boys"
"MATCH FIT MONTCLAIR UNITED 2005 BOYS U13 Boys EDP","TSF ACADEMY 2005B WHITE U13 Boys EDP","Northeast School NES","U13","Boys"
"CEDAR STARS ACADEMY MONMOUTH B-2005 GREEN U13 Boys EDP","WASHINGTON UNITED 05B U13 Boys EDP","Capelli Sport Complex (Wayside Rd) #4 FS","U13","Boys"
"HPSC BULLDOGS 05 U13 Boys EDP","WORLD CLASS PREMIER RANGERS U13 Boys EDP","Ridge Road Rec Pk Field 05","U13","Boys"
"PASSAIC YOUTH SOCCER DUNDEE LIONS U13 Boys EDP","ARSENAL HAMMERS U13 Boys EDP","Pulaski Park","U13","Boys"
"MIDDLETOWN SC BAYERN U13 Boys EDP","FREEHOLD SL SCORPIONS BLUE U13 Boys EDP","Thompson Park #1","U13","Boys"
"PHILADELPHIA UKRAINIAN NATIONALS 05 METALURH GRAY U13 Boys EDP","VEREINIGUNG ERZGEBIRGE KICKERS U13 Boys EDP","Ukrainian Nationals Sports Complex #1","U13","Boys"
"WAYNE SC MILAN 2005-2006 U13 Boys EDP","EAST WINDSOR PAL BLUE DEVILS U13 Boys EDP","BARBOUR POND #4","U13","Boys"
"PASSAIC YOUTH SOCCER DUNDEE PIRATES U13 Boys EDP","MONTCLAIR UNITED 2005 BOYS WHITE U13 Boys EDP","Pulaski Park","U13","Boys"
"FCUSA 2005 BOYS U13 Boys EDP","STRONGHOLD SC CHELSEA U13 Boys EDP","Purnell School #1","U13","Boys"
"BSM ELITE 05 BLUE WARRIORS U13 Boys EDP","ARSENAL SOCCER SCHOOLS ACADEMY ADAMS U13 Boys EDP","Palisades Park Sports Complex","U13","Boys"
"BEACHWOOD SC TORNADOES U13 Boys EDP","RANCOCAS VALLEY SC 05 UNITED U13 Boys EDP","Jakes Branch County Park #1","U13","Boys"
"WSC ELITE SURF U13 Boys EDP","FC SPORTIKA PRE-ACADEMY 2005B U13 Boys EDP","Main WSC Turf #1","U13","Boys"
"FC COPA ACADEMY B05 BLACK SOUTH U13 Boys EDP","MEDFORD STRIKERS MAGIC U13 Boys EDP","Rowan Univ. West Campus Turf","U13","Boys"
"HARLEYSVILLE FC RANGERS '05 U13 Boys EDP","YMS GENERALS 05 U13 Boys EDP","Alderfer A1","U13","Boys"
"CLUB VALLEY 2010 DREAM CHASERS U13 Boys EDP","WEST NEW YORK S.C. WNY TIGERS U13 U13 Boys EDP","Unassigned","U13","Boys"
"CLARKSTOWN 2005 ELITE U13 Boys EDP","MANHATTAN SC FREEDOM U13 Boys EDP","Kennedy Dells Park #1","U13","Boys"
"STA-MUSC 2005B NPL U13 Boys EDP","PDA VAN BASTEN U13 Boys EDP","Central Park #4","U13","Boys"
"IRONBOUND SC 05RED-SUPER EAGLES U13 Boys EDP","CEDAR STARS ACADEMY BERGEN 2005 GREEN U13 Boys EDP","Ironbound Stadium B","U13","Boys"
"LIGHTHOUSE SC CYCLONES U13 Boys EDP","PDA SHORE 2005 SHEARER U13 Boys EDP","Lighthouse Soccer Field #1","U13","Boys"
"PIPELINE SC PRE-ACADEMY U13 Boys EDP","BRAUSA UNITED FUTEBOL BLUE 05 U13 Boys EDP","Baltimore PolyTech HS Turf","U13","Boys"
"SAC PREMIER BLUE 05 U13 Boys EDP","BETHESDA SC BLUE 05 U13 Boys EDP","Long Reach HS Stadium","U13","Boys"
"DUSC B2005 ORANGE U13 Boys EDP","BEACHSIDE OF CONNECTICUT SC BOYS 2005 U13 Boys EDP","Randalls Island #62","U13","Boys"
"IRONBOUND SC 05BLUE-SCORPIONS U13 Boys EDP","EPIC SPORTING STARS 2005 BLUE U13 Boys EDP","Riverfront Park #1","U13","Boys"
"HOLMDEL FC NJX JUVENTUS U13 Boys EDP","MARLBORO SA 2005 MUSTANGS BLUE U13 Boys EDP","Cross Farm #1","U13","Boys"
"SAC PREMIER WHITE 2005 U13 Boys EDP","DAVIDSONVILLE HOTSPUR U13 Boys EDP","Long Reach HS Stadium","U13","Boys"
"NC FORCE BLACK U13 Boys EDP","CAPITAL FC 05B RED U13 Boys EDP","Cape Horn Park #1","U13","Boys"
"MANHATTAN SC EARTHQUAKES U13 Boys EDP","ALLEYCATS ACADEMY RED 2005B U13 Boys EDP","Randallâs Island #85","U13","Boys"
"SDFC 2005B YELLOW U13 Boys EDP","STA-MUSC 2005B EDP U13 Boys EDP","SDFC 09 Fortunato Field HS","U13","Boys"
"FCUSA PHILADELPHIA 2005 BOYS BLACK U13 Boys EDP","WASHINGTON UNITED 05B U13 Boys EDP","Agnes Irwin School Turf","U13","Boys"
"PHILADELPHIA UKRAINIAN NATIONALS '05 RED U13 Boys EDP","PA RUSH 05B U13 Boys EDP","UASC #6","U13","Boys"
"ABINGDON FOOTBALL BARÃA U13 Boys EDP","LTSC 2005 (GREEN) U13 Boys EDP","Cedar Lane Regional Park #12 Turf","U13","Boys"
"FC POCONO ELITE ELITE 2005 BOYS U13 Boys EDP","CLIFTON STALLIONS FC CRUSH 05 U13 Boys EDP","Minisink Soccer Complex","U13","Boys"
"LSA LA PLATA POWER RED U13 Boys EDP","NLS AJAX 05 U13 Boys EDP","Bryantown Soccer Complex #12","U13","Boys"
"BARCELONA USA MD GAITHERSBURG 05B U13 Boys EDP","GO PREMIER SOCCER 05 BLUE U13 Boys EDP","Western Regional Park #7","U13","Boys"
"WARMINSTER UNITED 05' U13 Boys EDP","KEYSTONE ATHLETIC GRIFO BOYS 05 U13 Boys EDP","WCP #7","U13","Boys"
"RIVER SC BOYS 05 U13 Boys EDP","SALISBURY UNITED SC 05B MAROON U13 Boys EDP","River Soccer Club #1","U13","Boys"
"EAST BRUNSWICK STA TITANS U13 Boys EDP","NASA UNITED AC MILAN U13 Boys EDP","Dideriksen Park #2","U13","Boys"
"U.S. PARMA ROYAL 05 U13 Boys EDP","HILLSBOROUGH 05B RAIDERS RED U13 Boys EDP","The Wardlaw-Hartridge School Rear Turf Field #2","U13","Boys"
"JERSEY UNITED SOCCER SPARTANS 05B U13 Boys EDP","SPORTING PREMIER FC SCP  NIGHTHAWKS 05 U13 Boys EDP","Morristown Beard School - Lower #2","U13","Boys"
"SB4U ACADEMY LIVERPOOL U13 Boys EDP","FA EURO NEW YORK 2005/2006 U13 Boys EDP","Miller Fields","U13","Boys"
"STAFFORD SC HOTSPUR 05 U13 Boys EDP","TWIN COUNTY SA UNITED 2005 U13 Boys EDP","Doc Cramer Sports Complex #6","U13","Boys"
"YMS GENERALS 05 U13 Boys EDP","PRINCETON FC PSG U13 Boys EDP","Macclesfield Park F","U13","Boys"
"EWING UNITED FORCE U13 Boys EDP","YMS HURRICANE 05 U13 Boys EDP","LiMato Field","U13","Boys"
"LONG ISLAND PREMIER FC BOYS '05 U13 Boys EDP","SUSA ELITE BLUE B05 U13 Boys EDP","Venetian Shores Park","U13","Boys"
"WASHINGTON UNITED 05B U13 Boys EDP","DEPTFORD PREMIER FC '05 THUNDER U13 Boys EDP","WLP #5","U13","Boys"
"LONG ISLAND PREMIER FC BOYS '05 U13 Boys EDP","MANHATTAN SC FREEDOM U13 Boys EDP","North East Elementary School","U13","Boys"
"CLARKSTOWN 2005 ELITE U13 Boys EDP","SUSA ELITE BLUE B05 U13 Boys EDP","Kennedy Dells Park #1","U13","Boys"
"IRONBOUND SC 05RED-SUPER EAGLES U13 Boys EDP","TORPEDOES SC 2005B RED U13 Boys EDP","Riverfront Park #1","U13","Boys"
"PDA SHORE 2005 SHEARER U13 Boys EDP","CEDAR STARS ACADEMY STATEN ISLAND 2005 CAHILL U13 Boys EDP","Ocean County College Grass FS","U13","Boys"
"NJ WILDCATS UNION U13 Boys EDP","FC EUROPA 05B ELITE U13 Boys EDP","Manahassett Creek Park #1","U13","Boys"
"PARSIPPANY SC 2005 BOYS WHITE U13 Boys EDP","MATCH FIT MONTCLAIR UNITED 2005 BOYS U13 Boys EDP","Reynolds Ave Soccer Complex #1","U13","Boys"
"FOX CHASE UNITED JRS U13 Boys EDP","DEPTFORD PREMIER FC '05 THUNDER U13 Boys EDP","FCSC Main Field","U13","Boys"
"SEVERNA PARK PREMIER GREEN U13 Boys EDP","WORLD CLASS PREMIER RANGERS U13 Boys EDP","Kinder Park Lower Field 02","U13","Boys"
"PALMYRA RIVERTON SC UNITED FC U13 Boys EDP","UNIVERSAL USCSOCCER05 U13 Boys EDP","Legion Field #1","U13","Boys"
"LOWER MACUNGIE YOUTH SOCCER STRIKERS 05 BOYS U13 Boys EDP","ELECTRIC CITY SHOCK JUNIORS FC 05 VOLT U13 Boys EDP","Creamery Park LS2","U13","Boys"
"PIPELINE SC RED U13 Boys EDP","HENLOPEN STINGRAYS U13 Boys EDP","Baltimore PolyTech HS Turf","U13","Boys"
"PASSAIC YOUTH SOCCER DUNDEE PIRATES U13 Boys EDP","HAZLET UNITED DRAGONS U13 Boys EDP","Pulaski Park","U13","Boys"
"PATERSON REC. UNISAMBA U13 Boys EDP","JERSEY STARS JUVENTUS U13 Boys EDP","Pennigton Park #1","U13","Boys"
"DUTCH ELITE '05 BOYS U13 Boys EDP","ARSENAL SOCCER SCHOOLS ACADEMY ADAMS U13 Boys EDP","Stone Church field #1","U13","Boys"
"MEDFORD SC AVENGERS U13 Boys EDP","SJEB RUSH 05 BOYS PREMIER WHITE U13 Boys EDP","Medford Soccer Club - Bende Park #1","U13","Boys"
"GPS NJ SOUTH 05B U13 Boys EDP","TWIN COUNTY SA UNITED 2005 U13 Boys EDP","Tyler Davis Fields","U13","Boys"
"MONMOUTH UNITED SC SAINTS U13 Boys EDP","WSC ELITE SURF U13 Boys EDP","West Front","U13","Boys"
"HAMILTON ELITE FC MACHINE '05 U13 Boys EDP","PRINCETON FC LYON U13 Boys EDP","Hickory St Soccer 1 FS","U13","Boys"
"PRINCETON FC PSG U13 Boys EDP","WAYNE SC MILAN 2005-2006 U13 Boys EDP","Princeton FC Farmview Fields FS","U13","Boys"
"SUSA ELITE BLUE B05 U13 Boys EDP","CT RUSH ELITE 05 BOYS U13 Boys EDP","Baymen Soccer Complex #2","U13","Boys"
"LIGHTHOUSE SC CYCLONES U13 Boys EDP","YMS HIGHLANDERS 05 U13 Boys EDP","Lighthouse Soccer Field #1","U13","Boys"
"HARLEYSVILLE FC READY '05B U13 Boys EDP","PRINCETON SA PREMIER ELITE 05 U13 Boys EDP","Alderfer A1","U13","Boys"
"FC USA 2005 U13 Boys EDP","BRAUSA UNITED FUTEBOL BLUE 05 U13 Boys EDP","Cedar Lane Regional Park #12 Turf","U13","Boys"
"DUSC B2005 ORANGE U13 Boys EDP","SHORELINE FC AJAX U13 Boys EDP","Randalls Island #85","U13","Boys"
"BEACHSIDE OF CONNECTICUT SC BOYS 2005 U13 Boys EDP","NEW YORK SC B05 U13 Boys EDP","Sacred Heart University Turf","U13","Boys"
"TSF ACADEMY 2005B BLUE U13 Boys EDP","NORTHERN VALLEY NAVY U13 Boys EDP","De Paul Catholic #1","U13","Boys"
"HOLMDEL FC NJX JUVENTUS U13 Boys EDP","WSC ELITE BREAKERS U13 Boys EDP","Cross Farm #1","U13","Boys"
"HARRISON SC HUSKIES U13 Boys EDP","SJEB RUSH 05 BOYS ACADEMY BLUE U13 Boys EDP","William Wilt Soccer Complex","U13","Boys"
"DAVIDSONVILLE HOTSPUR U13 Boys EDP","NC FORCE BLACK U13 Boys EDP","Davidsonville Park Field F","U13","Boys"
"HUDSON VALLEY SELECT HV SELECT 2005 BLUE U13 Boys EDP","WESTCHESTER FLAMES 2005B U13 Boys EDP","Warwick Town Park A1","U13","Boys"
"NIRVANA 360 BOCA '05 U13 Boys EDP","WORLD CLASS FC '05 WHITE U13 Boys EDP","Hamptonburgh Park #1","U13","Boys"
"SDFC 2005B YELLOW U13 Boys EDP","BSM ELITE 05 COSMOS U13 Boys EDP","SDFC 09 Fortunato Field HS","U13","Boys"
"TSF ACADEMY 2005B WHITE U13 Boys EDP","SCOTCH PLAINS FANWOOD SA SPF NEYMAR U13 Boys EDP","DePaul High School #1","U13","Boys"
"CEDAR STARS ACADEMY MONMOUTH B-2005 GREEN U13 Boys EDP","FCUSA PHILADELPHIA 2005 BOYS BLACK U13 Boys EDP","Capelli Sport Complex (Wayside Rd) #6 FS","U13","Boys"
"PA RUSH 05B U13 Boys EDP","FC EUROPA 06' ELITE - 11 V 11 U13 Boys EDP","Rush Soccer Complex #2","U13","Boys"
"ASA LIVERPOOL FCIAA MD LIVERPOOL 05 ACADEMY (FORMERLY ASA PREDATORS) U13 Boys EDP","ABINGDON FOOTBALL BARÃA U13 Boys EDP","Kinder Park Lower Field 02","U13","Boys"
"MT OLIVE SC PREMIER UNITED U13 Boys EDP","FC POCONO ELITE ELITE 2005 BOYS U13 Boys EDP","Turkey Brook Park #4","U13","Boys"
"FREEHOLD SL SCORPIONS BLUE U13 Boys EDP","PRINCETON SA PREMIER 05 U13 Boys EDP","Jackson Mills JM1","U13","Boys"
"GO PREMIER SOCCER 05 BLUE U13 Boys EDP","PREMIER SC WHITE 05 U13 Boys EDP","Bretton Woods Field 01","U13","Boys"
"KEYSTONE ATHLETIC GRIFO BOYS 05 U13 Boys EDP","VEREINIGUNG ERZGEBIRGE KICKERS U13 Boys EDP","Keystone  Large-Sided #3","U13","Boys"
"RIVER SC BOYS 05 U13 Boys EDP","GPS DELAWARE REVOLUTION 05' RED U13 Boys EDP","River Soccer Club #1","U13","Boys"
"MONTCLAIR UNITED 2005 BOYS WHITE U13 Boys EDP","U.S. PARMA ROYAL 05 U13 Boys EDP","Brookdale Park Stadium BPS","U13","Boys"
"OLD BRIDGE SL CREW U13 Boys EDP","FA EURO NEW YORK 2005/2006 U13 Boys EDP","Unassigned","U13","Boys"
"PASCO THUNDER U13 Boys EDP","BSM ELITE 05 BLUE WARRIORS U13 Boys EDP","BARBOUR POND # 4","U13","Boys"
"MEDFORD STRIKERS MAGIC U13 Boys EDP","YMS GENERALS 05 U13 Boys EDP","Medford Strikers","U13","Boys"
"PA RUSH NERO 05 U13 Boys EDP","PRINCETON FC PSG U13 Boys EDP","Rush Soccer Complex #1","U13","Boys"
"LAWRENCE HAMNETT SA JAGUARS U13 Boys EDP","JERSEY KNIGHTS SC GLADIATORS 2005 U13 Boys EDP","Twin Pines","U13","Boys"
"STRONGHOLD SC CHELSEA U13 Boys EDP","WEST NEW YORK S.C. WNY TIGERS U13 U13 Boys EDP","STRONGHOLD SC - Gill St. Bernard's School Turf","U13","Boys"
"CLUB VALLEY 2010 DREAM CHASERS U13 Boys EDP","WAYNE SC MILAN 2005-2006 U13 Boys EDP","Unassigned","U13","Boys"
"BRIDGEWATER SA IMPACT U13 Boys EDP","UNIVERSAL USCSOCCER05 U13 Boys EDP","BRHS-TURF #2","U13","Boys"
"FOX CHASE REVOLUTION U13 Boys EDP","PATRIOT FC B '05 BOYS - RED U13 Boys EDP","FCSC Main Field","U13","Boys"
"TORPEDOES SC 2005B RED U13 Boys EDP","PDA VAN BASTEN U13 Boys EDP","Pulis #1","U13","Boys"
"WASHINGTON UNITED 05B U13 Boys EDP","MAINLAND UNITED SA MAMBAS U13 Boys EDP","WLP #5","U13","Boys"
"ELIZABETH YSC DRAGONS U13 Boys EDP","HAMILTON VIPERS U13 Boys EDP","Waterfront Field #1","U13","Boys"
"HARLEYSVILLE FC READY '05B U13 Boys EDP","MATCH FIT ACADEMY FC PRE ECNL 05 HEAT U13 Boys EDP","Alderfer A1","U13","Boys"
"WASHINGTON DIPLOMATS 05 U13 Boys EDP","PREMIER SC NAVY 05 U13 Boys EDP","Cardinal Gibbons School Babe Ruth","U13","Boys"
"FC USA 2005 U13 Boys EDP","AFFC STORM U13 Boys EDP","Carsins Run Field A","U13","Boys"
"FC COPA ACADEMY B05 BLACK U13 Boys EDP","WESTFIELD SA UNION COUNTY FC PREMIER PUMAS U13 Boys EDP","Rutgers-Busch University Park Turf","U13","Boys"
"NORTHERN VALLEY NAVY U13 Boys EDP","IRONBOUND SC 05BLUE-SCORPIONS U13 Boys EDP","Stone Point Park","U13","Boys"
"PDA HIBERNIAN COPA 05 U13 Boys EDP","HARRISON SC HUSKIES U13 Boys EDP","PDA South Westampton Sports Complex #1","U13","Boys"
"WALDORF SC '05 BOYS - ORANGE U13 Boys EDP","DAVIDSONVILLE HOTSPUR U13 Boys EDP","Bryantown Sports Complex #3","U13","Boys"
"STA-MUSC 2005B EDP U13 Boys EDP","MATCH FIT MONTCLAIR UNITED 2005 BOYS U13 Boys EDP","Central Park #2","U13","Boys"
"DEPTFORD PREMIER FC '05 THUNDER U13 Boys EDP","FC EUROPA 06' ELITE - 11 V 11 U13 Boys EDP","Unassigned","U13","Boys"
"MD RUSH MONTGOMERY ACADEMY BLACK '05B AJAX U13 Boys EDP","LTSC 2005 (GREEN) U13 Boys EDP","Ridge Road Rec Pk Field 05","U13","Boys"
"CLIFTON STALLIONS FC CRUSH 05 U13 Boys EDP","MT OLIVE SC PREMIER UNITED U13 Boys EDP","Athenia Steel Recreation Complex #1","U13","Boys"
"PRINCETON SA PREMIER 05 U13 Boys EDP","FC BERNA LEGACY 05B U13 Boys EDP","Stuart Country Day School Field #1","U13","Boys"
"ELECTRIC CITY SHOCK JUNIORS FC 05 VOLT U13 Boys EDP","PHILADELPHIA UKRAINIAN NATIONALS 05 METALURH GRAY U13 Boys EDP","Luzerne County Sports Complex A","U13","Boys"
"GPS DELAWARE REVOLUTION 05' RED U13 Boys EDP","PIPELINE SC RED U13 Boys EDP","Delaware Sports Complex EDP Futures Festival #1","U13","Boys"
"SB4U ACADEMY LIVERPOOL U13 Boys EDP","JERSEY STARS JUVENTUS U13 Boys EDP","Owl Howl Soccer Fields #3","U13","Boys"
"JERSEY CREW SC JAGUARS U13 Boys EDP","BSM ELITE 05 BLUE WARRIORS U13 Boys EDP","Montville Community Park #3","U13","Boys"
"SWSA VATRENI STRIKERS 05/06 U13 Boys EDP","STAFFORD SC HOTSPUR 05 U13 Boys EDP","Locke Ave G","U13","Boys"
"WSC ELITE SURF U13 Boys EDP","RANCOCAS VALLEY SC 05 UNITED U13 Boys EDP","Main WSC Turf #1","U13","Boys"
"PRINCETON FC PSG U13 Boys EDP","GPS NJ CLEARVIEW 05B U13 Boys EDP","Princeton FC","U13","Boys"
"PRINCETON FC LYON U13 Boys EDP","WEST-MONT UNITED SA UNITED 2005 U13 Boys EDP","Princeton FC Farmview Fields FS","U13","Boys"
"HAZLET UNITED DRAGONS U13 Boys EDP","PATERSON REC. UNISAMBA U13 Boys EDP","HUSA Complex #4","U13","Boys"
"PHILADELPHIA UKRAINIAN NATIONALS '05 BLACK U13 Boys EDP","CEDAR STARS ACADEMY BERGEN 2005 GREEN U13 Boys EDP","Ukrainian Nationals Sports Complex #6","U13","Boys"
"LOWER MERION VORTEX U13 Boys EDP","PDA SHORE 2005 SHEARER U13 Boys EDP","SOUTH ARDMORE PLAYGROUND Field","U13","Boys"
"PREMIER SC NAVY 05 U13 Boys EDP","BETHESDA SC BLUE 05 U13 Boys EDP","Notre Dame Prep School #1","U13","Boys"
"SAC PREMIER BLUE 05 U13 Boys EDP","AFFC STORM U13 Boys EDP","Covenant Park Field 01","U13","Boys"
"FUSA ARSENAL U13 Boys EDP","FUTURE_SA_05 U13 Boys EDP","Unassigned","U13","Boys"
"NORTHERN VALLEY NAVY U13 Boys EDP","EPIC SPORTING STARS 2005 BLUE U13 Boys EDP","Stone Point Park","U13","Boys"
"WESTFIELD SA UNION COUNTY FC PREMIER PUMAS U13 Boys EDP","TITANES DELFINES U13 Boys EDP","Houlihan","U13","Boys"
"FC EUROPA 05B ELITE U13 Boys EDP","MARLBORO SA 2005 MUSTANGS BLUE U13 Boys EDP","The Proving Ground #3","U13","Boys"
"NC FORCE BLACK U13 Boys EDP","SAC PREMIER WHITE 2005 U13 Boys EDP","Cape Horn Park #1","U13","Boys"
"WESTCHESTER FLAMES 2005B U13 Boys EDP","ALLEYCATS ACADEMY RED 2005B U13 Boys EDP","City Park Fosina","U13","Boys"
"CLIFTON STALLIONS FC FAHRENHEIT U13 Boys EDP","SDFC 2005B YELLOW U13 Boys EDP","Athenia Steel Recreation Complex #1","U13","Boys"
"WASHINGTON UNITED 05B U13 Boys EDP","FOX CHASE UNITED JRS U13 Boys EDP","WLP #3","U13","Boys"
"WORLD CLASS PREMIER RANGERS U13 Boys EDP","ELLICOTT CITY 2005 BOYS SILVER U13 Boys EDP","Martin Luther King Pk #4","U13","Boys"
"PASSAIC YOUTH SOCCER DUNDEE LIONS U13 Boys EDP","CEDAR STARS ACADEMY BERGEN WEST 2005 IGNITION GREEN U13 Boys EDP","Christopher Columbus Park #1","U13","Boys"
"MT OLIVE SC PREMIER UNITED U13 Boys EDP","ELIZABETH YSC DRAGONS U13 Boys EDP","Turkey Brook Park #4","U13","Boys"
"BRIDGEWATER SA IMPACT U13 Boys EDP","PALMYRA RIVERTON SC UNITED FC U13 Boys EDP","Crim #1F","U13","Boys"
"FREEDOM PHOENIX U13 Boys EDP","PREMIER SC WHITE 05 U13 Boys EDP","Western Regional Park #4","U13","Boys"
"PREMIER SC WHITE 05 U13 Boys EDP","BARCELONA USA MD GAITHERSBURG 05B U13 Boys EDP","Notre Dame Prep Turf","U13","Boys"
"SALISBURY UNITED SC 05B MAROON U13 Boys EDP","SHORE FC BLACK U13 Boys EDP","Falcon Sports Complex Field 10","U13","Boys"
"WAYNE SC MILAN 2005-2006 U13 Boys EDP","NASA UNITED AC MILAN U13 Boys EDP","PCT High School Football","U13","Boys"
"U.S. PARMA ROYAL 05 U13 Boys EDP","HAZLET UNITED DRAGONS U13 Boys EDP","The Wardlaw-Hartridge School Rear Turf Field #2","U13","Boys"
"SPORTING PREMIER FC SCP  NIGHTHAWKS 05 U13 Boys EDP","JERSEY STARS JUVENTUS U13 Boys EDP","Unassigned","U13","Boys"
"OLD BRIDGE SL CREW U13 Boys EDP","EDISON UNITED SA COSMOS U13 Boys EDP","Geick Park","U13","Boys"
"TWIN COUNTY SA UNITED 2005 U13 Boys EDP","FREEHOLD SL THUNDER U13 Boys EDP","Drum Point Sports Complex #1","U13","Boys"
"FC SPORTIKA PRE-ACADEMY 2005B U13 Boys EDP","CEDAR STARS ACADEMY MONMOUTH B-2005 WHITE U13 Boys EDP","Sportika Sports","U13","Boys"
"PATRIOT FC B '05 BOYS - RED U13 Boys EDP","PA RUSH NERO 05 U13 Boys EDP","Veterans Park (11v11)","U13","Boys"
"YMS HURRICANE 05 U13 Boys EDP","HARLEYSVILLE FC RANGERS '05 U13 Boys EDP","Macclesfield Park F","U13","Boys"
"LAWRENCE HAMNETT SA JAGUARS U13 Boys EDP","PRINCETON FC LYON U13 Boys EDP","Twin Pines","U13","Boys"
"CEDAR STARS ACADEMY MONMOUTH B-2006 WHITE U13 Boys EDP","MIDDLETOWN SC ATTACK BLACK U13 Boys EDP","Capelli Sport Complex (Wayside Rd) #6 SS A","U13","Boys"
"HARLEYSVILLE FC READY '05B U13 Boys EDP","FC COPA ACADEMY B05 BLACK U13 Boys EDP","Alderfer A1","U13","Boys"
"WEST NEW YORK S.C. WNY TIGERS U13 U13 Boys EDP","TSF ACADEMY 2005B WHITE U13 Boys EDP","Unassigned","U13","Boys"
"PRINCETON SA PREMIER ELITE 05 U13 Boys EDP","CEDAR STARS ACADEMY STATEN ISLAND 2005 CAHILL U13 Boys EDP","Stuart Country Day School Field #1","U13","Boys"
"BSM ELITE 05 COSMOS U13 Boys EDP","TSF ACADEMY 2005B WHITE U13 Boys EDP","Palisades Park Sports Complex","U13","Boys"
"FREEHOLD SL SCORPIONS BLUE U13 Boys EDP","HAMILTON VIPERS U13 Boys EDP","OPATUT PARK #5","U13","Boys"
"SUMMIT SC SUMMIT BHOYS U13 Boys EDP","WESTFIELD SA UNION COUNTY FC PREMIER PUMAS U13 Boys EDP","Summit Glenside Field #01","U13","Boys"
"PARSIPPANY SC 2005 BOYS ACADEMY BLUE U13 Boys EDP","IRONBOUND SC 05RED-SUPER EAGLES U13 Boys EDP","Reynolds #1","U13","Boys"
"PDA VAN BASTEN U13 Boys EDP","WATCHUNG HILLS NJ ELITE 2005B PSV U13 Boys EDP","PDA","U13","Boys"
"BETHESDA SC BLUE 05 U13 Boys EDP","FC USA 2005 U13 Boys EDP","Walter Johnson HS Turf","U13","Boys"
"NJ WILDCATS UNION U13 Boys EDP","SJEB RUSH 05 BOYS ACADEMY BLUE U13 Boys EDP","Manahassett Creek Park #1","U13","Boys"
"MARYLAND UNITED FC 2005 PRE-ECNL U13 Boys EDP","DAVIDSONVILLE HOTSPUR U13 Boys EDP","Murtaugh Field 02","U13","Boys"
"NY STARS PREMIER NEBULA U13 Boys EDP","HUDSON VALLEY SELECT HV SELECT 2005 BLUE U13 Boys EDP","Warwick Town Park A1","U13","Boys"
"MAINLAND UNITED SA MAMBAS U13 Boys EDP","PHILADELPHIA UKRAINIAN NATIONALS '05 RED U13 Boys EDP","Memorial Park FIeld Upper #1","U13","Boys"
"ASA LIVERPOOL FCIAA MD LIVERPOOL 05 ACADEMY (FORMERLY ASA PREDATORS) U13 Boys EDP","ELLICOTT CITY 2005 BOYS SILVER U13 Boys EDP","Arundel HS Turf","U13","Boys"
"CEDAR STARS ACADEMY BERGEN WEST 2005 IGNITION GREEN U13 Boys EDP","ARSENAL HAMMERS U13 Boys EDP","Overpeck #1","U13","Boys"
"MIDDLETOWN SC BAYERN U13 Boys EDP","UNIVERSAL USCSOCCER05 U13 Boys EDP","Thompson Park #1","U13","Boys"
"FREEDOM PHOENIX U13 Boys EDP","BARCELONA USA MD GAITHERSBURG 05B U13 Boys EDP","Marriotts Ridge HS","U13","Boys"
"PHILADELPHIA UKRAINIAN NATIONALS 05 METALURH GRAY U13 Boys EDP","KEYSTONE ATHLETIC GRIFO BOYS 05 U13 Boys EDP","Ukrainian Nationals Sports Complex #1","U13","Boys"
"EAST WINDSOR PAL BLUE DEVILS U13 Boys EDP","MORRIS ELITE 05B EDP U13 Boys EDP","East Windsor PAL A","U13","Boys"
"HILLSBOROUGH 05B RAIDERS RED U13 Boys EDP","ELITE PLAINFIELD ELITE REVOLUTION U13 Boys EDP","Hillsborough SC - Country Classics #2","U13","Boys"
"FCUSA 2005 BOYS U13 Boys EDP","NJ STALLIONS ACADEMY 05 ZICO U13 Boys EDP","Purnell School","U13","Boys"
"PASCO THUNDER U13 Boys EDP","ARSENAL SOCCER SCHOOLS ACADEMY ADAMS U13 Boys EDP","Barbour Pond Field #3","U13","Boys"
"CEDAR STARS ACADEMY MONMOUTH B-2005 WHITE U13 Boys EDP","MANALAPAN SC GPS 05B U13 Boys EDP","Capelli Sport Complex (Wayside Rd) #6 FS","U13","Boys"
"PRINCETON FC LYON U13 Boys EDP","JERSEY KNIGHTS SC GLADIATORS 2005 U13 Boys EDP","Princeton FC Farmview Fields FS","U13","Boys"
"LAWRENCE HAMNETT SA JAGUARS U13 Boys EDP","YMS GENERALS 05 U13 Boys EDP","Twin Pines","U13","Boys"
"PRINCETON FC BORUSSIA U13 Boys EDP","FC COPA ACADEMY B05 BLACK U13 Boys EDP","Princeton FC Farmview Fields FS","U13","Boys"
"NASA UNITED AC MILAN U13 Boys EDP","CLUB VALLEY 2010 DREAM CHASERS U13 Boys EDP","NASA - PCTI","U13","Boys"
"STAMFORD YSL STAMFORD FC '05 U13 Boys EDP","MANHATTAN SC FREEDOM U13 Boys EDP","Westbeach Turf","U13","Boys"
"VALENCIA CF ACADEMY NY 2005 BLACK U13 Boys EDP","CT RUSH ELITE 05 BOYS U13 Boys EDP","LIU: CW Post Campus #1","U13","Boys"
"MATCH FIT ACADEMY FC PRE ECNL 05 HEAT U13 Boys EDP","CHERRY HILL FC ATTACK U13 Boys EDP","Mercer County College Turf","U13","Boys"
"HARLEYSVILLE FC READY '05B U13 Boys EDP","LIGHTHOUSE SC CYCLONES U13 Boys EDP","Alderfer A1","U13","Boys"
"WASHINGTON DIPLOMATS 05 U13 Boys EDP","BRAUSA UNITED FUTEBOL BLUE 05 U13 Boys EDP","Ft. Stevens Recreation Center","U13","Boys"
"SHORELINE FC AJAX U13 Boys EDP","FUSA ARSENAL U13 Boys EDP","Greenwich Catholic #1","U13","Boys"
"OCEANSIDE FURY U13 Boys EDP","DUSC B2005 ORANGE U13 Boys EDP","Oceanside Park #1","U13","Boys"
"CEDAR STARS ACADEMY NEWARK 2005 GREEN U13 Boys EDP","NORTHERN VALLEY NAVY U13 Boys EDP","Capelli Sport Field at St. Benedict's Preparatory School Field (Lower) #1","U13","Boys"
"HARRISON SC HUSKIES U13 Boys EDP","MARLBORO SA 2005 MUSTANGS BLUE U13 Boys EDP","William Wilt Soccer Complex","U13","Boys"
"CAPITAL FC 05B RED U13 Boys EDP","SAC PREMIER WHITE 2005 U13 Boys EDP","Ridge Road Rec Center DC","U13","Boys"
"PIPELINE SC BLACK U13 Boys EDP","MARYLAND UNITED FC 2005 PRE-ECNL U13 Boys EDP","Baltimore PolyTech HS Turf","U13","Boys"
"WESTCHESTER FLAMES 2005B U13 Boys EDP","MANHATTAN SC EARTHQUAKES U13 Boys EDP","City Park Skidelsk","U13","Boys"
"CLIFTON STALLIONS FC FAHRENHEIT U13 Boys EDP","SCOTCH PLAINS FANWOOD SA SPF NEYMAR U13 Boys EDP","Athenia Steel Recreation Complex #1","U13","Boys"
"TSF ACADEMY 2005B WHITE U13 Boys EDP","CAPS GREATER FLEMINGTON 05 ARSENAL U13 Boys EDP","De Paul Catholic #1","U13","Boys"
"WASHINGTON UNITED 05B U13 Boys EDP","SJEB RUSH 05 BOYS PREMIER BLUE U13 Boys EDP","WLP #5","U13","Boys"
"PA RUSH 05B U13 Boys EDP","DEPTFORD PREMIER FC '05 THUNDER U13 Boys EDP","Rush Soccer Complex #2","U13","Boys"
"ARSENAL HAMMERS U13 Boys EDP","FC POCONO ELITE ELITE 2005 BOYS U13 Boys EDP","Pascack Hills High School #1","U13","Boys"
"BRIDGEWATER SA IMPACT U13 Boys EDP","PRINCETON SA PREMIER 05 U13 Boys EDP","Crim #1F","U13","Boys"
"FC USA 2005/2006 U13 Boys EDP","SALISBURY UNITED SC 05B GOLD U13 Boys EDP","Carsins Run Fields Field A","U13","Boys"
"HORSHAM HEAT U13 Boys EDP","VEREINIGUNG ERZGEBIRGE KICKERS U13 Boys EDP","Kohler Park #2","U13","Boys"
"SHORE FC BLACK U13 Boys EDP","RIVER SC BOYS 05 U13 Boys EDP","Saints Peter and Paul High School #1","U13","Boys"
"EAST BRUNSWICK STA TITANS U13 Boys EDP","AMERICAS UNITED CELTIC U13 Boys EDP","Unassigned","U13","Boys"
"HAZLET UNITED DRAGONS U13 Boys EDP","ELITE PLAINFIELD ELITE REVOLUTION U13 Boys EDP","HUSA Complex #2","U13","Boys"
"MONTCLAIR UNITED 2005 BOYS WHITE U13 Boys EDP","PRO YOUTH BLUE U13 Boys EDP","Northeast School NES","U13","Boys"
"SPORTING PREMIER FC SCP  NIGHTHAWKS 05 U13 Boys EDP","FA EURO NEW YORK 2005/2006 U13 Boys EDP","Unassigned","U13","Boys"
"SB4U ACADEMY LIVERPOOL U13 Boys EDP","OLD BRIDGE SL CREW U13 Boys EDP","Owl Howl Soccer Fields #4","U13","Boys"
"STAFFORD SC HOTSPUR 05 U13 Boys EDP","GPS NJ SOUTH 05B U13 Boys EDP","Doc Cramer Sports Complex #6","U13","Boys"
"FC SPORTIKA PRE-ACADEMY 2005B U13 Boys EDP","MONMOUTH UNITED SC SAINTS U13 Boys EDP","Sportika Sports","U13","Boys"
"PATRIOT FC B '05 BOYS - RED U13 Boys EDP","GPS NJ CLEARVIEW 05B U13 Boys EDP","Veterans Park (11v11)","U13","Boys"
"FOX CHASE REVOLUTION U13 Boys EDP","FC COPA ACADEMY B05 BLACK SOUTH U13 Boys EDP","FCSC Main Field","U13","Boys"
"WEST-MONT UNITED SA UNITED 2005 U13 Boys EDP","EWING UNITED FORCE U13 Boys EDP","Hill Top #9","U13","Boys"
"LAWRENCE HAMNETT SA JAGUARS U13 Boys EDP","HAMILTON ELITE FC MACHINE '05 U13 Boys EDP","Twin Pines","U13","Boys"
"UPPER DUBLIN BLACK KNIGHTS U13 Boys EDP","PRINCETON FC BORUSSIA U13 Boys EDP","Edwards #1","U13","Boys"
"BSM ELITE 05 COSMOS U13 Boys EDP","PARSIPPANY SC 2005 BOYS WHITE U13 Boys EDP","Palisades Park Sports Complex","U13","Boys"
"FREEHOLD SL SCORPIONS BLUE U13 Boys EDP","ELIZABETH YSC DRAGONS U13 Boys EDP","OPATUT PARK #5","U13","Boys"
"STAMFORD YSL STAMFORD FC '05 U13 Boys EDP","LONG ISLAND PREMIER FC BOYS '05 U13 Boys EDP","Westbeach Turf","U13","Boys"
"IRONBOUND SC 05RED-SUPER EAGLES U13 Boys EDP","WATCHUNG HILLS NJ ELITE 2005B PSV U13 Boys EDP","Riverfront Park #1","U13","Boys"
